[
  {
    "HicriTarihKisa": "30.6.1447",
    "HicriTarihKisaIso8601": null,
    "HicriTarihUzun": "30 Cemaziyelahir 1447",
    "HicriTarihUzunIso8601": null,
    "AyinSekliURL": "https://namazvakti.diyanet.gov.tr/images/ruyet.gif",
    "MiladiTarihKisa": "20.12.2025",
    "MiladiTarihKisaIso8601": "20.12.2025",
    "MiladiTarihUzun": "20 Aralık 2025 Cumartesi",
    "MiladiTarihUzunIso8601": "2025-12-20T00:00:00.0000000+03:00",
    "GreenwichOrtalamaZamani": 3.0,
    "Aksam": "16:57",
    "Gunes": "07:16",
    "GunesBatis": "16:50",
    "GunesDogus": "07:23",
    "Ikindi": "14:36",
    "Imsak": "05:47",
    "KibleSaati": "12:41",
    "Ogle": "12:12",
    "Yatsi": "18:20"
  },
  {
    "HicriTarihKisa": "1.7.1447",
    "HicriTarihKisaIso8601": null,
    "HicriTarihUzun": "1 Recep 1447",
    "HicriTarihUzunIso8601": null,
    "AyinSekliURL": "https://namazvakti.diyanet.gov.tr/images/r1.gif",
    "MiladiTarihKisa": "21.12.2025",
    "MiladiTarihKisaIso8601": "21.12.2025",
    "MiladiTarihUzun": "21 Aralık 2025 Pazar",
    "MiladiTarihUzunIso8601": "2025-12-21T00:00:00.0000000+03:00",
    "GreenwichOrtalamaZamani": 3.0,
    "Aksam": "16:57",
    "Gunes": "07:17",
    "GunesBatis": "16:50",
    "GunesDogus": "07:24",
    "Ikindi": "14:37",
    "Imsak": "05:48",
    "KibleSaati": "12:42",
    "Ogle": "12:12",
    "Yatsi": "18:21"
  },
  {
    "HicriTarihKisa": "2.7.1447",
    "HicriTarihKisaIso8601": null,
    "HicriTarihUzun": "2 Recep 1447",
    "HicriTarihUzunIso8601": null,
    "AyinSekliURL": "https://namazvakti.diyanet.gov.tr/images/r2.gif",
    "MiladiTarihKisa": "22.12.2025",
    "MiladiTarihKisaIso8601": "22.12.2025",
    "MiladiTarihUzun": "22 Aralık 2025 Pazartesi",
    "MiladiTarihUzunIso8601": "2025-12-22T00:00:00.0000000+03:00",
    "GreenwichOrtalamaZamani": 3.0,
    "Aksam": "16:58",
    "Gunes": "07:17",
    "GunesBatis": "16:51",
    "GunesDogus": "07:24",
    "Ikindi": "14:37",
    "Imsak": "05:48",
    "KibleSaati": "12:42",
    "Ogle": "12:13",
    "Yatsi": "18:21"
  },
  {
    "HicriTarihKisa": "3.7.1447",
    "HicriTarihKisaIso8601": null,
    "HicriTarihUzun": "3 Recep 1447",
    "HicriTarihUzunIso8601": null,
    "AyinSekliURL": "https://namazvakti.diyanet.gov.tr/images/r3.gif",
    "MiladiTarihKisa": "23.12.2025",
    "MiladiTarihKisaIso8601": "23.12.2025",
    "MiladiTarihUzun": "23 Aralık 2025 Salı",
    "MiladiTarihUzunIso8601": "2025-12-23T00:00:00.0000000+03:00",
    "GreenwichOrtalamaZamani": 3.0,
    "Aksam": "16:58",
    "Gunes": "07:18",
    "GunesBatis": "16:51",
    "GunesDogus": "07:25",
    "Ikindi": "14:38",
    "Imsak": "05:49",
    "KibleSaati": "12:43",
    "Ogle": "12:13",
    "Yatsi": "18:22"
  },
  {
    "HicriTarihKisa": "4.7.1447",
    "HicriTarihKisaIso8601": null,
    "HicriTarihUzun": "4 Recep 1447",
    "HicriTarihUzunIso8601": null,
    "AyinSekliURL": "https://namazvakti.diyanet.gov.tr/images/r4.gif",
    "MiladiTarihKisa": "24.12.2025",
    "MiladiTarihKisaIso8601": "24.12.2025",
    "MiladiTarihUzun": "24 Aralık 2025 Çarşamba",
    "MiladiTarihUzunIso8601": "2025-12-24T00:00:00.0000000+03:00",
    "GreenwichOrtalamaZamani": 3.0,
    "Aksam": "16:59",
    "Gunes": "07:18",
    "GunesBatis": "16:52",
    "GunesDogus": "07:25",
    "Ikindi": "14:38",
    "Imsak": "05:49",
    "KibleSaati": "12:43",
    "Ogle": "12:14",
    "Yatsi": "18:22"
  },
  {
    "HicriTarihKisa": "5.7.1447",
    "HicriTarihKisaIso8601": null,
    "HicriTarihUzun": "5 Recep 1447",
    "HicriTarihUzunIso8601": null,
    "AyinSekliURL": "https://namazvakti.diyanet.gov.tr/images/r5.gif",
    "MiladiTarihKisa": "25.12.2025",
    "MiladiTarihKisaIso8601": "25.12.2025",
    "MiladiTarihUzun": "25 Aralık 2025 Perşembe",
    "MiladiTarihUzunIso8601": "2025-12-25T00:00:00.0000000+03:00",
    "GreenwichOrtalamaZamani": 3.0,
    "Aksam": "17:00",
    "Gunes": "07:18",
    "GunesBatis": "16:53",
    "GunesDogus": "07:25",
    "Ikindi": "14:39",
    "Imsak": "05:50",
    "KibleSaati": "12:44",
    "Ogle": "12:14",
    "Yatsi": "18:23"
  },
  {
    "HicriTarihKisa": "6.7.1447",
    "HicriTarihKisaIso8601": null,
    "HicriTarihUzun": "6 Recep 1447",
    "HicriTarihUzunIso8601": null,
    "AyinSekliURL": "https://namazvakti.diyanet.gov.tr/images/r6.gif",
    "MiladiTarihKisa": "26.12.2025",
    "MiladiTarihKisaIso8601": "26.12.2025",
    "MiladiTarihUzun": "26 Aralık 2025 Cuma",
    "MiladiTarihUzunIso8601": "2025-12-26T00:00:00.0000000+03:00",
    "GreenwichOrtalamaZamani": 3.0,
    "Aksam": "17:00",
    "Gunes": "07:19",
    "GunesBatis": "16:53",
    "GunesDogus": "07:26",
    "Ikindi": "14:40",
    "Imsak": "05:50",
    "KibleSaati": "12:44",
    "Ogle": "12:14",
    "Yatsi": "18:24"
  },
  {
    "HicriTarihKisa": "7.7.1447",
    "HicriTarihKisaIso8601": null,
    "HicriTarihUzun": "7 Recep 1447",
    "HicriTarihUzunIso8601": null,
    "AyinSekliURL": "https://namazvakti.diyanet.gov.tr/images/ilkdordun.gif",
    "MiladiTarihKisa": "27.12.2025",
    "MiladiTarihKisaIso8601": "27.12.2025",
    "MiladiTarihUzun": "27 Aralık 2025 Cumartesi",
    "MiladiTarihUzunIso8601": "2025-12-27T00:00:00.0000000+03:00",
    "GreenwichOrtalamaZamani": 3.0,
    "Aksam": "17:01",
    "Gunes": "07:19",
    "GunesBatis": "16:54",
    "GunesDogus": "07:26",
    "Ikindi": "14:40",
    "Imsak": "05:50",
    "KibleSaati": "12:45",
    "Ogle": "12:15",
    "Yatsi": "18:24"
  },
  {
    "HicriTarihKisa": "8.7.1447",
    "HicriTarihKisaIso8601": null,
    "HicriTarihUzun": "8 Recep 1447",
    "HicriTarihUzunIso8601": null,
    "AyinSekliURL": "https://namazvakti.diyanet.gov.tr/images/i1.gif",
    "MiladiTarihKisa": "28.12.2025",
    "MiladiTarihKisaIso8601": "28.12.2025",
    "MiladiTarihUzun": "28 Aralık 2025 Pazar",
    "MiladiTarihUzunIso8601": "2025-12-28T00:00:00.0000000+03:00",
    "GreenwichOrtalamaZamani": 3.0,
    "Aksam": "17:01",
    "Gunes": "07:20",
    "GunesBatis": "16:54",
    "GunesDogus": "07:27",
    "Ikindi": "14:41",
    "Imsak": "05:51",
    "KibleSaati": "12:45",
    "Ogle": "12:15",
    "Yatsi": "18:25"
  },
  {
    "HicriTarihKisa": "9.7.1447",
    "HicriTarihKisaIso8601": null,
    "HicriTarihUzun": "9 Recep 1447",
    "HicriTarihUzunIso8601": null,
    "AyinSekliURL": "https://namazvakti.diyanet.gov.tr/images/i2.gif",
    "MiladiTarihKisa": "29.12.2025",
    "MiladiTarihKisaIso8601": "29.12.2025",
    "MiladiTarihUzun": "29 Aralık 2025 Pazartesi",
    "MiladiTarihUzunIso8601": "2025-12-29T00:00:00.0000000+03:00",
    "GreenwichOrtalamaZamani": 3.0,
    "Aksam": "17:02",
    "Gunes": "07:20",
    "GunesBatis": "16:55",
    "GunesDogus": "07:27",
    "Ikindi": "14:41",
    "Imsak": "05:51",
    "KibleSaati": "12:46",
    "Ogle": "12:16",
    "Yatsi": "18:25"
  },
  {
    "HicriTarihKisa": "10.7.1447",
    "HicriTarihKisaIso8601": null,
    "HicriTarihUzun": "10 Recep 1447",
    "HicriTarihUzunIso8601": null,
    "AyinSekliURL": "https://namazvakti.diyanet.gov.tr/images/i3.gif",
    "MiladiTarihKisa": "30.12.2025",
    "MiladiTarihKisaIso8601": "30.12.2025",
    "MiladiTarihUzun": "30 Aralık 2025 Salı",
    "MiladiTarihUzunIso8601": "2025-12-30T00:00:00.0000000+03:00",
    "GreenwichOrtalamaZamani": 3.0,
    "Aksam": "17:03",
    "Gunes": "07:20",
    "GunesBatis": "16:56",
    "GunesDogus": "07:27",
    "Ikindi": "14:42",
    "Imsak": "05:51",
    "KibleSaati": "12:46",
    "Ogle": "12:16",
    "Yatsi": "18:26"
  },
  {
    "HicriTarihKisa": "11.7.1447",
    "HicriTarihKisaIso8601": null,
    "HicriTarihUzun": "11 Recep 1447",
    "HicriTarihUzunIso8601": null,
    "AyinSekliURL": "https://namazvakti.diyanet.gov.tr/images/i4.gif",
    "MiladiTarihKisa": "31.12.2025",
    "MiladiTarihKisaIso8601": "31.12.2025",
    "MiladiTarihUzun": "31 Aralık 2025 Çarşamba",
    "MiladiTarihUzunIso8601": "2025-12-31T00:00:00.0000000+03:00",
    "GreenwichOrtalamaZamani": 3.0,
    "Aksam": "17:04",
    "Gunes": "07:20",
    "GunesBatis": "16:57",
    "GunesDogus": "07:27",
    "Ikindi": "14:43",
    "Imsak": "05:52",
    "KibleSaati": "12:47",
    "Ogle": "12:17",
    "Yatsi": "18:27"
  },
  {
    "HicriTarihKisa": "12.7.1447",
    "HicriTarihKisaIso8601": null,
    "HicriTarihUzun": "12 Recep 1447",
    "HicriTarihUzunIso8601": null,
    "AyinSekliURL": "https://namazvakti.diyanet.gov.tr/images/i6.gif",
    "MiladiTarihKisa": "01.01.2026",
    "MiladiTarihKisaIso8601": "01.01.2026",
    "MiladiTarihUzun": "01 Ocak 2026 Perşembe",
    "MiladiTarihUzunIso8601": "2026-01-01T00:00:00.0000000+03:00",
    "GreenwichOrtalamaZamani": 3.0,
    "Aksam": "17:04",
    "Gunes": "07:20",
    "GunesBatis": "16:57",
    "GunesDogus": "07:27",
    "Ikindi": "14:44",
    "Imsak": "05:52",
    "KibleSaati": "12:47",
    "Ogle": "12:17",
    "Yatsi": "18:28"
  },
  {
    "HicriTarihKisa": "13.7.1447",
    "HicriTarihKisaIso8601": null,
    "HicriTarihUzun": "13 Recep 1447",
    "HicriTarihUzunIso8601": null,
    "AyinSekliURL": "https://namazvakti.diyanet.gov.tr/images/i7.gif",
    "MiladiTarihKisa": "02.01.2026",
    "MiladiTarihKisaIso8601": "02.01.2026",
    "MiladiTarihUzun": "02 Ocak 2026 Cuma",
    "MiladiTarihUzunIso8601": "2026-01-02T00:00:00.0000000+03:00",
    "GreenwichOrtalamaZamani": 3.0,
    "Aksam": "17:05",
    "Gunes": "07:21",
    "GunesBatis": "16:58",
    "GunesDogus": "07:28",
    "Ikindi": "14:44",
    "Imsak": "05:52",
    "KibleSaati": "12:48",
    "Ogle": "12:18",
    "Yatsi": "18:28"
  },
  {
    "HicriTarihKisa": "14.7.1447",
    "HicriTarihKisaIso8601": null,
    "HicriTarihUzun": "14 Recep 1447",
    "HicriTarihUzunIso8601": null,
    "AyinSekliURL": "https://namazvakti.diyanet.gov.tr/images/dolunay.gif",
    "MiladiTarihKisa": "03.01.2026",
    "MiladiTarihKisaIso8601": "03.01.2026",
    "MiladiTarihUzun": "03 Ocak 2026 Cumartesi",
    "MiladiTarihUzunIso8601": "2026-01-03T00:00:00.0000000+03:00",
    "GreenwichOrtalamaZamani": 3.0,
    "Aksam": "17:06",
    "Gunes": "07:21",
    "GunesBatis": "16:59",
    "GunesDogus": "07:28",
    "Ikindi": "14:45",
    "Imsak": "05:52",
    "KibleSaati": "12:48",
    "Ogle": "12:18",
    "Yatsi": "18:29"
  },
  {
    "HicriTarihKisa": "15.7.1447",
    "HicriTarihKisaIso8601": null,
    "HicriTarihUzun": "15 Recep 1447",
    "HicriTarihUzunIso8601": null,
    "AyinSekliURL": "https://namazvakti.diyanet.gov.tr/images/d1.gif",
    "MiladiTarihKisa": "04.01.2026",
    "MiladiTarihKisaIso8601": "04.01.2026",
    "MiladiTarihUzun": "04 Ocak 2026 Pazar",
    "MiladiTarihUzunIso8601": "2026-01-04T00:00:00.0000000+03:00",
    "GreenwichOrtalamaZamani": 3.0,
    "Aksam": "17:07",
    "Gunes": "07:21",
    "GunesBatis": "17:00",
    "GunesDogus": "07:28",
    "Ikindi": "14:46",
    "Imsak": "05:52",
    "KibleSaati": "12:48",
    "Ogle": "12:19",
    "Yatsi": "18:30"
  },
  {
    "HicriTarihKisa": "16.7.1447",
    "HicriTarihKisaIso8601": null,
    "HicriTarihUzun": "16 Recep 1447",
    "HicriTarihUzunIso8601": null,
    "AyinSekliURL": "https://namazvakti.diyanet.gov.tr/images/d2.gif",
    "MiladiTarihKisa": "05.01.2026",
    "MiladiTarihKisaIso8601": "05.01.2026",
    "MiladiTarihUzun": "05 Ocak 2026 Pazartesi",
    "MiladiTarihUzunIso8601": "2026-01-05T00:00:00.0000000+03:00",
    "GreenwichOrtalamaZamani": 3.0,
    "Aksam": "17:08",
    "Gunes": "07:21",
    "GunesBatis": "17:01",
    "GunesDogus": "07:28",
    "Ikindi": "14:47",
    "Imsak": "05:53",
    "KibleSaati": "12:49",
    "Ogle": "12:19",
    "Yatsi": "18:31"
  },
  {
    "HicriTarihKisa": "17.7.1447",
    "HicriTarihKisaIso8601": null,
    "HicriTarihUzun": "17 Recep 1447",
    "HicriTarihUzunIso8601": null,
    "AyinSekliURL": "https://namazvakti.diyanet.gov.tr/images/d3.gif",
    "MiladiTarihKisa": "06.01.2026",
    "MiladiTarihKisaIso8601": "06.01.2026",
    "MiladiTarihUzun": "06 Ocak 2026 Salı",
    "MiladiTarihUzunIso8601": "2026-01-06T00:00:00.0000000+03:00",
    "GreenwichOrtalamaZamani": 3.0,
    "Aksam": "17:09",
    "Gunes": "07:21",
    "GunesBatis": "17:02",
    "GunesDogus": "07:28",
    "Ikindi": "14:48",
    "Imsak": "05:53",
    "KibleSaati": "12:49",
    "Ogle": "12:20",
    "Yatsi": "18:31"
  },
  {
    "HicriTarihKisa": "18.7.1447",
    "HicriTarihKisaIso8601": null,
    "HicriTarihUzun": "18 Recep 1447",
    "HicriTarihUzunIso8601": null,
    "AyinSekliURL": "https://namazvakti.diyanet.gov.tr/images/d4.gif",
    "MiladiTarihKisa": "07.01.2026",
    "MiladiTarihKisaIso8601": "07.01.2026",
    "MiladiTarihUzun": "07 Ocak 2026 Çarşamba",
    "MiladiTarihUzunIso8601": "2026-01-07T00:00:00.0000000+03:00",
    "GreenwichOrtalamaZamani": 3.0,
    "Aksam": "17:10",
    "Gunes": "07:21",
    "GunesBatis": "17:03",
    "GunesDogus": "07:28",
    "Ikindi": "14:48",
    "Imsak": "05:53",
    "KibleSaati": "12:49",
    "Ogle": "12:20",
    "Yatsi": "18:32"
  },
  {
    "HicriTarihKisa": "19.7.1447",
    "HicriTarihKisaIso8601": null,
    "HicriTarihUzun": "19 Recep 1447",
    "HicriTarihUzunIso8601": null,
    "AyinSekliURL": "https://namazvakti.diyanet.gov.tr/images/d5.gif",
    "MiladiTarihKisa": "08.01.2026",
    "MiladiTarihKisaIso8601": "08.01.2026",
    "MiladiTarihUzun": "08 Ocak 2026 Perşembe",
    "MiladiTarihUzunIso8601": "2026-01-08T00:00:00.0000000+03:00",
    "GreenwichOrtalamaZamani": 3.0,
    "Aksam": "17:11",
    "Gunes": "07:21",
    "GunesBatis": "17:04",
    "GunesDogus": "07:28",
    "Ikindi": "14:49",
    "Imsak": "05:53",
    "KibleSaati": "12:50",
    "Ogle": "12:21",
    "Yatsi": "18:33"
  },
  {
    "HicriTarihKisa": "20.7.1447",
    "HicriTarihKisaIso8601": null,
    "HicriTarihUzun": "20 Recep 1447",
    "HicriTarihUzunIso8601": null,
    "AyinSekliURL": "https://namazvakti.diyanet.gov.tr/images/d6.gif",
    "MiladiTarihKisa": "09.01.2026",
    "MiladiTarihKisaIso8601": "09.01.2026",
    "MiladiTarihUzun": "09 Ocak 2026 Cuma",
    "MiladiTarihUzunIso8601": "2026-01-09T00:00:00.0000000+03:00",
    "GreenwichOrtalamaZamani": 3.0,
    "Aksam": "17:12",
    "Gunes": "07:20",
    "GunesBatis": "17:05",
    "GunesDogus": "07:27",
    "Ikindi": "14:50",
    "Imsak": "05:53",
    "KibleSaati": "12:50",
    "Ogle": "12:21",
    "Yatsi": "18:34"
  },
  {
    "HicriTarihKisa": "21.7.1447",
    "HicriTarihKisaIso8601": null,
    "HicriTarihUzun": "21 Recep 1447",
    "HicriTarihUzunIso8601": null,
    "AyinSekliURL": "https://namazvakti.diyanet.gov.tr/images/sondordun.gif",
    "MiladiTarihKisa": "10.01.2026",
    "MiladiTarihKisaIso8601": "10.01.2026",
    "MiladiTarihUzun": "10 Ocak 2026 Cumartesi",
    "MiladiTarihUzunIso8601": "2026-01-10T00:00:00.0000000+03:00",
    "GreenwichOrtalamaZamani": 3.0,
    "Aksam": "17:13",
    "Gunes": "07:20",
    "GunesBatis": "17:06",
    "GunesDogus": "07:27",
    "Ikindi": "14:51",
    "Imsak": "05:53",
    "KibleSaati": "12:50",
    "Ogle": "12:21",
    "Yatsi": "18:35"
  },
  {
    "HicriTarihKisa": "22.7.1447",
    "HicriTarihKisaIso8601": null,
    "HicriTarihUzun": "22 Recep 1447",
    "HicriTarihUzunIso8601": null,
    "AyinSekliURL": "https://namazvakti.diyanet.gov.tr/images/sd1.gif",
    "MiladiTarihKisa": "11.01.2026",
    "MiladiTarihKisaIso8601": "11.01.2026",
    "MiladiTarihUzun": "11 Ocak 2026 Pazar",
    "MiladiTarihUzunIso8601": "2026-01-11T00:00:00.0000000+03:00",
    "GreenwichOrtalamaZamani": 3.0,
    "Aksam": "17:14",
    "Gunes": "07:20",
    "GunesBatis": "17:07",
    "GunesDogus": "07:27",
    "Ikindi": "14:52",
    "Imsak": "05:53",
    "KibleSaati": "12:51",
    "Ogle": "12:22",
    "Yatsi": "18:36"
  },
  {
    "HicriTarihKisa": "23.7.1447",
    "HicriTarihKisaIso8601": null,
    "HicriTarihUzun": "23 Recep 1447",
    "HicriTarihUzunIso8601": null,
    "AyinSekliURL": "https://namazvakti.diyanet.gov.tr/images/sd2.gif",
    "MiladiTarihKisa": "12.01.2026",
    "MiladiTarihKisaIso8601": "12.01.2026",
    "MiladiTarihUzun": "12 Ocak 2026 Pazartesi",
    "MiladiTarihUzunIso8601": "2026-01-12T00:00:00.0000000+03:00",
    "GreenwichOrtalamaZamani": 3.0,
    "Aksam": "17:15",
    "Gunes": "07:20",
    "GunesBatis": "17:08",
    "GunesDogus": "07:27",
    "Ikindi": "14:53",
    "Imsak": "05:53",
    "KibleSaati": "12:51",
    "Ogle": "12:22",
    "Yatsi": "18:37"
  },
  {
    "HicriTarihKisa": "24.7.1447",
    "HicriTarihKisaIso8601": null,
    "HicriTarihUzun": "24 Recep 1447",
    "HicriTarihUzunIso8601": null,
    "AyinSekliURL": "https://namazvakti.diyanet.gov.tr/images/sd3.gif",
    "MiladiTarihKisa": "13.01.2026",
    "MiladiTarihKisaIso8601": "13.01.2026",
    "MiladiTarihUzun": "13 Ocak 2026 Salı",
    "MiladiTarihUzunIso8601": "2026-01-13T00:00:00.0000000+03:00",
    "GreenwichOrtalamaZamani": 3.0,
    "Aksam": "17:16",
    "Gunes": "07:20",
    "GunesBatis": "17:09",
    "GunesDogus": "07:27",
    "Ikindi": "14:54",
    "Imsak": "05:52",
    "KibleSaati": "12:51",
    "Ogle": "12:23",
    "Yatsi": "18:37"
  },
  {
    "HicriTarihKisa": "25.7.1447",
    "HicriTarihKisaIso8601": null,
    "HicriTarihUzun": "25 Recep 1447",
    "HicriTarihUzunIso8601": null,
    "AyinSekliURL": "https://namazvakti.diyanet.gov.tr/images/sd4.gif",
    "MiladiTarihKisa": "14.01.2026",
    "MiladiTarihKisaIso8601": "14.01.2026",
    "MiladiTarihUzun": "14 Ocak 2026 Çarşamba",
    "MiladiTarihUzunIso8601": "2026-01-14T00:00:00.0000000+03:00",
    "GreenwichOrtalamaZamani": 3.0,
    "Aksam": "17:17",
    "Gunes": "07:19",
    "GunesBatis": "17:10",
    "GunesDogus": "07:26",
    "Ikindi": "14:55",
    "Imsak": "05:52",
    "KibleSaati": "12:52",
    "Ogle": "12:23",
    "Yatsi": "18:38"
  },
  {
    "HicriTarihKisa": "26.7.1447",
    "HicriTarihKisaIso8601": null,
    "HicriTarihUzun": "26 Recep 1447",
    "HicriTarihUzunIso8601": null,
    "AyinSekliURL": "https://namazvakti.diyanet.gov.tr/images/sd5.gif",
    "MiladiTarihKisa": "15.01.2026",
    "MiladiTarihKisaIso8601": "15.01.2026",
    "MiladiTarihUzun": "15 Ocak 2026 Perşembe",
    "MiladiTarihUzunIso8601": "2026-01-15T00:00:00.0000000+03:00",
    "GreenwichOrtalamaZamani": 3.0,
    "Aksam": "17:18",
    "Gunes": "07:19",
    "GunesBatis": "17:11",
    "GunesDogus": "07:26",
    "Ikindi": "14:56",
    "Imsak": "05:52",
    "KibleSaati": "12:52",
    "Ogle": "12:23",
    "Yatsi": "18:39"
  },
  {
    "HicriTarihKisa": "27.7.1447",
    "HicriTarihKisaIso8601": null,
    "HicriTarihUzun": "27 Recep 1447",
    "HicriTarihUzunIso8601": null,
    "AyinSekliURL": "https://namazvakti.diyanet.gov.tr/images/sd6.gif",
    "MiladiTarihKisa": "16.01.2026",
    "MiladiTarihKisaIso8601": "16.01.2026",
    "MiladiTarihUzun": "16 Ocak 2026 Cuma",
    "MiladiTarihUzunIso8601": "2026-01-16T00:00:00.0000000+03:00",
    "GreenwichOrtalamaZamani": 3.0,
    "Aksam": "17:19",
    "Gunes": "07:19",
    "GunesBatis": "17:12",
    "GunesDogus": "07:26",
    "Ikindi": "14:57",
    "Imsak": "05:52",
    "KibleSaati": "12:52",
    "Ogle": "12:24",
    "Yatsi": "18:40"
  },
  {
    "HicriTarihKisa": "28.7.1447",
    "HicriTarihKisaIso8601": null,
    "HicriTarihUzun": "28 Recep 1447",
    "HicriTarihUzunIso8601": null,
    "AyinSekliURL": "https://namazvakti.diyanet.gov.tr/images/sd7.gif",
    "MiladiTarihKisa": "17.01.2026",
    "MiladiTarihKisaIso8601": "17.01.2026",
    "MiladiTarihUzun": "17 Ocak 2026 Cumartesi",
    "MiladiTarihUzunIso8601": "2026-01-17T00:00:00.0000000+03:00",
    "GreenwichOrtalamaZamani": 3.0,
    "Aksam": "17:20",
    "Gunes": "07:18",
    "GunesBatis": "17:13",
    "GunesDogus": "07:25",
    "Ikindi": "14:58",
    "Imsak": "05:52",
    "KibleSaati": "12:52",
    "Ogle": "12:24",
    "Yatsi": "18:41"
  },
  {
    "HicriTarihKisa": "29.7.1447",
    "HicriTarihKisaIso8601": null,
    "HicriTarihUzun": "29 Recep 1447",
    "HicriTarihUzunIso8601": null,
    "AyinSekliURL": "https://namazvakti.diyanet.gov.tr/images/ictima.gif",
    "MiladiTarihKisa": "18.01.2026",
    "MiladiTarihKisaIso8601": "18.01.2026",
    "MiladiTarihUzun": "18 Ocak 2026 Pazar",
    "MiladiTarihUzunIso8601": "2026-01-18T00:00:00.0000000+03:00",
    "GreenwichOrtalamaZamani": 3.0,
    "Aksam": "17:21",
    "Gunes": "07:18",
    "GunesBatis": "17:14",
    "GunesDogus": "07:25",
    "Ikindi": "14:58",
    "Imsak": "05:51",
    "KibleSaati": "12:53",
    "Ogle": "12:24",
    "Yatsi": "18:42"
  },
  {
    "HicriTarihKisa": "30.7.1447",
    "HicriTarihKisaIso8601": null,
    "HicriTarihUzun": "30 Recep 1447",
    "HicriTarihUzunIso8601": null,
    "AyinSekliURL": "https://namazvakti.diyanet.gov.tr/images/ruyet.gif",
    "MiladiTarihKisa": "19.01.2026",
    "MiladiTarihKisaIso8601": "19.01.2026",
    "MiladiTarihUzun": "19 Ocak 2026 Pazartesi",
    "MiladiTarihUzunIso8601": "2026-01-19T00:00:00.0000000+03:00",
    "GreenwichOrtalamaZamani": 3.0,
    "Aksam": "17:22",
    "Gunes": "07:17",
    "GunesBatis": "17:15",
    "GunesDogus": "07:24",
    "Ikindi": "14:59",
    "Imsak": "05:51",
    "KibleSaati": "12:53",
    "Ogle": "12:25",
    "Yatsi": "18:43"
  },
  {
    "HicriTarihKisa": "1.8.1447",
    "HicriTarihKisaIso8601": null,
    "HicriTarihUzun": "1 Şaban 1447",
    "HicriTarihUzunIso8601": null,
    "AyinSekliURL": "https://namazvakti.diyanet.gov.tr/images/r1.gif",
    "MiladiTarihKisa": "20.01.2026",
    "MiladiTarihKisaIso8601": "20.01.2026",
    "MiladiTarihUzun": "20 Ocak 2026 Salı",
    "MiladiTarihUzunIso8601": "2026-01-20T00:00:00.0000000+03:00",
    "GreenwichOrtalamaZamani": 3.0,
    "Aksam": "17:23",
    "Gunes": "07:17",
    "GunesBatis": "17:16",
    "GunesDogus": "07:24",
    "Ikindi": "15:00",
    "Imsak": "05:51",
    "KibleSaati": "12:53",
    "Ogle": "12:25",
    "Yatsi": "18:44"
  }
]