[
  {
    "HicriTarihKisa": "5.7.1447",
    "HicriTarihKisaIso8601": null,
    "HicriTarihUzun": "5 Recep 1447",
    "HicriTarihUzunIso8601": null,
    "AyinSekliURL": "https://namazvakti.diyanet.gov.tr/images/r5.gif",
    "MiladiTarihKisa": "25.12.2025",
    "MiladiTarihKisaIso8601": "25.12.2025",
    "MiladiTarihUzun": "25 Aralık 2025 Perşembe",
    "MiladiTarihUzunIso8601": "2025-12-25T00:00:00.0000000-11:00",
    "GreenwichOrtalamaZamani": 3.0,
    "Aksam": "19:05",
    "Gunes": "05:34",
    "GunesBatis": "18:58",
    "GunesDogus": "05:41",
    "Ikindi": "15:46",
    "Imsak": "04:18",
    "KibleSaati": "20:55",
    "Ogle": "12:25",
    "Yatsi": "20:16"
  },
  {
    "HicriTarihKisa": "6.7.1447",
    "HicriTarihKisaIso8601": null,
    "HicriTarihUzun": "6 Recep 1447",
    "HicriTarihUzunIso8601": null,
    "AyinSekliURL": "https://namazvakti.diyanet.gov.tr/images/r6.gif",
    "MiladiTarihKisa": "26.12.2025",
    "MiladiTarihKisaIso8601": "26.12.2025",
    "MiladiTarihUzun": "26 Aralık 2025 Cuma",
    "MiladiTarihUzunIso8601": "2025-12-26T00:00:00.0000000-11:00",
    "GreenwichOrtalamaZamani": 3.0,
    "Aksam": "19:05",
    "Gunes": "05:35",
    "GunesBatis": "18:58",
    "GunesDogus": "05:42",
    "Ikindi": "15:46",
    "Imsak": "04:19",
    "KibleSaati": "20:56",
    "Ogle": "12:25",
    "Yatsi": "20:16"
  },
  {
    "HicriTarihKisa": "7.7.1447",
    "HicriTarihKisaIso8601": null,
    "HicriTarihUzun": "7 Recep 1447",
    "HicriTarihUzunIso8601": null,
    "AyinSekliURL": "https://namazvakti.diyanet.gov.tr/images/ilkdordun.gif",
    "MiladiTarihKisa": "27.12.2025",
    "MiladiTarihKisaIso8601": "27.12.2025",
    "MiladiTarihUzun": "27 Aralık 2025 Cumartesi",
    "MiladiTarihUzunIso8601": "2025-12-27T00:00:00.0000000-11:00",
    "GreenwichOrtalamaZamani": 3.0,
    "Aksam": "19:06",
    "Gunes": "05:35",
    "GunesBatis": "18:59",
    "GunesDogus": "05:42",
    "Ikindi": "15:47",
    "Imsak": "04:19",
    "KibleSaati": "20:57",
    "Ogle": "12:26",
    "Yatsi": "20:17"
  },
  {
    "HicriTarihKisa": "8.7.1447",
    "HicriTarihKisaIso8601": null,
    "HicriTarihUzun": "8 Recep 1447",
    "HicriTarihUzunIso8601": null,
    "AyinSekliURL": "https://namazvakti.diyanet.gov.tr/images/i1.gif",
    "MiladiTarihKisa": "28.12.2025",
    "MiladiTarihKisaIso8601": "28.12.2025",
    "MiladiTarihUzun": "28 Aralık 2025 Pazar",
    "MiladiTarihUzunIso8601": "2025-12-28T00:00:00.0000000-11:00",
    "GreenwichOrtalamaZamani": 3.0,
    "Aksam": "19:06",
    "Gunes": "05:36",
    "GunesBatis": "18:59",
    "GunesDogus": "05:43",
    "Ikindi": "15:47",
    "Imsak": "04:20",
    "KibleSaati": "20:59",
    "Ogle": "12:26",
    "Yatsi": "20:17"
  },
  {
    "HicriTarihKisa": "9.7.1447",
    "HicriTarihKisaIso8601": null,
    "HicriTarihUzun": "9 Recep 1447",
    "HicriTarihUzunIso8601": null,
    "AyinSekliURL": "https://namazvakti.diyanet.gov.tr/images/i2.gif",
    "MiladiTarihKisa": "29.12.2025",
    "MiladiTarihKisaIso8601": "29.12.2025",
    "MiladiTarihUzun": "29 Aralık 2025 Pazartesi",
    "MiladiTarihUzunIso8601": "2025-12-29T00:00:00.0000000-11:00",
    "GreenwichOrtalamaZamani": 3.0,
    "Aksam": "19:07",
    "Gunes": "05:37",
    "GunesBatis": "19:00",
    "GunesDogus": "05:44",
    "Ikindi": "15:47",
    "Imsak": "04:21",
    "KibleSaati": "21:00",
    "Ogle": "12:27",
    "Yatsi": "20:18"
  },
  {
    "HicriTarihKisa": "10.7.1447",
    "HicriTarihKisaIso8601": null,
    "HicriTarihUzun": "10 Recep 1447",
    "HicriTarihUzunIso8601": null,
    "AyinSekliURL": "https://namazvakti.diyanet.gov.tr/images/i3.gif",
    "MiladiTarihKisa": "30.12.2025",
    "MiladiTarihKisaIso8601": "30.12.2025",
    "MiladiTarihUzun": "30 Aralık 2025 Salı",
    "MiladiTarihUzunIso8601": "2025-12-30T00:00:00.0000000-11:00",
    "GreenwichOrtalamaZamani": 3.0,
    "Aksam": "19:07",
    "Gunes": "05:37",
    "GunesBatis": "19:00",
    "GunesDogus": "05:44",
    "Ikindi": "15:48",
    "Imsak": "04:21",
    "KibleSaati": "21:02",
    "Ogle": "12:27",
    "Yatsi": "20:18"
  },
  {
    "HicriTarihKisa": "11.7.1447",
    "HicriTarihKisaIso8601": null,
    "HicriTarihUzun": "11 Recep 1447",
    "HicriTarihUzunIso8601": null,
    "AyinSekliURL": "https://namazvakti.diyanet.gov.tr/images/i4.gif",
    "MiladiTarihKisa": "31.12.2025",
    "MiladiTarihKisaIso8601": "31.12.2025",
    "MiladiTarihUzun": "31 Aralık 2025 Çarşamba",
    "MiladiTarihUzunIso8601": "2025-12-31T00:00:00.0000000-11:00",
    "GreenwichOrtalamaZamani": 3.0,
    "Aksam": "19:07",
    "Gunes": "05:38",
    "GunesBatis": "19:00",
    "GunesDogus": "05:45",
    "Ikindi": "15:48",
    "Imsak": "04:22",
    "KibleSaati": "21:04",
    "Ogle": "12:28",
    "Yatsi": "20:18"
  },
  {
    "HicriTarihKisa": "12.7.1447",
    "HicriTarihKisaIso8601": null,
    "HicriTarihUzun": "12 Recep 1447",
    "HicriTarihUzunIso8601": null,
    "AyinSekliURL": "https://namazvakti.diyanet.gov.tr/images/i6.gif",
    "MiladiTarihKisa": "01.01.2026",
    "MiladiTarihKisaIso8601": "01.01.2026",
    "MiladiTarihUzun": "01 Ocak 2026 Perşembe",
    "MiladiTarihUzunIso8601": "2026-01-01T00:00:00.0000000-11:00",
    "GreenwichOrtalamaZamani": 3.0,
    "Aksam": "19:08",
    "Gunes": "05:38",
    "GunesBatis": "19:01",
    "GunesDogus": "05:45",
    "Ikindi": "15:48",
    "Imsak": "04:23",
    "KibleSaati": "21:06",
    "Ogle": "12:28",
    "Yatsi": "20:19"
  },
  {
    "HicriTarihKisa": "13.7.1447",
    "HicriTarihKisaIso8601": null,
    "HicriTarihUzun": "13 Recep 1447",
    "HicriTarihUzunIso8601": null,
    "AyinSekliURL": "https://namazvakti.diyanet.gov.tr/images/i7.gif",
    "MiladiTarihKisa": "02.01.2026",
    "MiladiTarihKisaIso8601": "02.01.2026",
    "MiladiTarihUzun": "02 Ocak 2026 Cuma",
    "MiladiTarihUzunIso8601": "2026-01-02T00:00:00.0000000-11:00",
    "GreenwichOrtalamaZamani": 3.0,
    "Aksam": "19:08",
    "Gunes": "05:39",
    "GunesBatis": "19:01",
    "GunesDogus": "05:46",
    "Ikindi": "15:49",
    "Imsak": "04:23",
    "KibleSaati": "21:08",
    "Ogle": "12:29",
    "Yatsi": "20:19"
  },
  {
    "HicriTarihKisa": "14.7.1447",
    "HicriTarihKisaIso8601": null,
    "HicriTarihUzun": "14 Recep 1447",
    "HicriTarihUzunIso8601": null,
    "AyinSekliURL": "https://namazvakti.diyanet.gov.tr/images/dolunay.gif",
    "MiladiTarihKisa": "03.01.2026",
    "MiladiTarihKisaIso8601": "03.01.2026",
    "MiladiTarihUzun": "03 Ocak 2026 Cumartesi",
    "MiladiTarihUzunIso8601": "2026-01-03T00:00:00.0000000-11:00",
    "GreenwichOrtalamaZamani": 3.0,
    "Aksam": "19:08",
    "Gunes": "05:40",
    "GunesBatis": "19:01",
    "GunesDogus": "05:47",
    "Ikindi": "15:49",
    "Imsak": "04:24",
    "KibleSaati": "21:11",
    "Ogle": "12:29",
    "Yatsi": "20:19"
  },
  {
    "HicriTarihKisa": "15.7.1447",
    "HicriTarihKisaIso8601": null,
    "HicriTarihUzun": "15 Recep 1447",
    "HicriTarihUzunIso8601": null,
    "AyinSekliURL": "https://namazvakti.diyanet.gov.tr/images/d1.gif",
    "MiladiTarihKisa": "04.01.2026",
    "MiladiTarihKisaIso8601": "04.01.2026",
    "MiladiTarihUzun": "04 Ocak 2026 Pazar",
    "MiladiTarihUzunIso8601": "2026-01-04T00:00:00.0000000-11:00",
    "GreenwichOrtalamaZamani": 3.0,
    "Aksam": "19:09",
    "Gunes": "05:40",
    "GunesBatis": "19:02",
    "GunesDogus": "05:47",
    "Ikindi": "15:49",
    "Imsak": "04:25",
    "KibleSaati": "21:14",
    "Ogle": "12:29",
    "Yatsi": "20:19"
  },
  {
    "HicriTarihKisa": "16.7.1447",
    "HicriTarihKisaIso8601": null,
    "HicriTarihUzun": "16 Recep 1447",
    "HicriTarihUzunIso8601": null,
    "AyinSekliURL": "https://namazvakti.diyanet.gov.tr/images/d2.gif",
    "MiladiTarihKisa": "05.01.2026",
    "MiladiTarihKisaIso8601": "05.01.2026",
    "MiladiTarihUzun": "05 Ocak 2026 Pazartesi",
    "MiladiTarihUzunIso8601": "2026-01-05T00:00:00.0000000-11:00",
    "GreenwichOrtalamaZamani": 3.0,
    "Aksam": "19:09",
    "Gunes": "05:41",
    "GunesBatis": "19:02",
    "GunesDogus": "05:48",
    "Ikindi": "15:49",
    "Imsak": "04:25",
    "KibleSaati": "21:17",
    "Ogle": "12:30",
    "Yatsi": "20:19"
  },
  {
    "HicriTarihKisa": "17.7.1447",
    "HicriTarihKisaIso8601": null,
    "HicriTarihUzun": "17 Recep 1447",
    "HicriTarihUzunIso8601": null,
    "AyinSekliURL": "https://namazvakti.diyanet.gov.tr/images/d3.gif",
    "MiladiTarihKisa": "06.01.2026",
    "MiladiTarihKisaIso8601": "06.01.2026",
    "MiladiTarihUzun": "06 Ocak 2026 Salı",
    "MiladiTarihUzunIso8601": "2026-01-06T00:00:00.0000000-11:00",
    "GreenwichOrtalamaZamani": 3.0,
    "Aksam": "19:09",
    "Gunes": "05:42",
    "GunesBatis": "19:02",
    "GunesDogus": "05:49",
    "Ikindi": "15:49",
    "Imsak": "04:26",
    "KibleSaati": "21:21",
    "Ogle": "12:30",
    "Yatsi": "20:20"
  },
  {
    "HicriTarihKisa": "18.7.1447",
    "HicriTarihKisaIso8601": null,
    "HicriTarihUzun": "18 Recep 1447",
    "HicriTarihUzunIso8601": null,
    "AyinSekliURL": "https://namazvakti.diyanet.gov.tr/images/d4.gif",
    "MiladiTarihKisa": "07.01.2026",
    "MiladiTarihKisaIso8601": "07.01.2026",
    "MiladiTarihUzun": "07 Ocak 2026 Çarşamba",
    "MiladiTarihUzunIso8601": "2026-01-07T00:00:00.0000000-11:00",
    "GreenwichOrtalamaZamani": 3.0,
    "Aksam": "19:09",
    "Gunes": "05:42",
    "GunesBatis": "19:02",
    "GunesDogus": "05:49",
    "Ikindi": "15:50",
    "Imsak": "04:27",
    "KibleSaati": "21:25",
    "Ogle": "12:31",
    "Yatsi": "20:20"
  },
  {
    "HicriTarihKisa": "19.7.1447",
    "HicriTarihKisaIso8601": null,
    "HicriTarihUzun": "19 Recep 1447",
    "HicriTarihUzunIso8601": null,
    "AyinSekliURL": "https://namazvakti.diyanet.gov.tr/images/d5.gif",
    "MiladiTarihKisa": "08.01.2026",
    "MiladiTarihKisaIso8601": "08.01.2026",
    "MiladiTarihUzun": "08 Ocak 2026 Perşembe",
    "MiladiTarihUzunIso8601": "2026-01-08T00:00:00.0000000-11:00",
    "GreenwichOrtalamaZamani": 3.0,
    "Aksam": "19:10",
    "Gunes": "05:43",
    "GunesBatis": "19:03",
    "GunesDogus": "05:50",
    "Ikindi": "15:50",
    "Imsak": "04:28",
    "KibleSaati": "21:29",
    "Ogle": "12:31",
    "Yatsi": "20:20"
  },
  {
    "HicriTarihKisa": "20.7.1447",
    "HicriTarihKisaIso8601": null,
    "HicriTarihUzun": "20 Recep 1447",
    "HicriTarihUzunIso8601": null,
    "AyinSekliURL": "https://namazvakti.diyanet.gov.tr/images/d6.gif",
    "MiladiTarihKisa": "09.01.2026",
    "MiladiTarihKisaIso8601": "09.01.2026",
    "MiladiTarihUzun": "09 Ocak 2026 Cuma",
    "MiladiTarihUzunIso8601": "2026-01-09T00:00:00.0000000-11:00",
    "GreenwichOrtalamaZamani": 3.0,
    "Aksam": "19:10",
    "Gunes": "05:43",
    "GunesBatis": "19:03",
    "GunesDogus": "05:50",
    "Ikindi": "15:50",
    "Imsak": "04:28",
    "KibleSaati": "21:35",
    "Ogle": "12:32",
    "Yatsi": "20:20"
  },
  {
    "HicriTarihKisa": "21.7.1447",
    "HicriTarihKisaIso8601": null,
    "HicriTarihUzun": "21 Recep 1447",
    "HicriTarihUzunIso8601": null,
    "AyinSekliURL": "https://namazvakti.diyanet.gov.tr/images/sondordun.gif",
    "MiladiTarihKisa": "10.01.2026",
    "MiladiTarihKisaIso8601": "10.01.2026",
    "MiladiTarihUzun": "10 Ocak 2026 Cumartesi",
    "MiladiTarihUzunIso8601": "2026-01-10T00:00:00.0000000-11:00",
    "GreenwichOrtalamaZamani": 3.0,
    "Aksam": "19:10",
    "Gunes": "05:44",
    "GunesBatis": "19:03",
    "GunesDogus": "05:51",
    "Ikindi": "15:50",
    "Imsak": "04:29",
    "KibleSaati": "21:41",
    "Ogle": "12:32",
    "Yatsi": "20:20"
  },
  {
    "HicriTarihKisa": "22.7.1447",
    "HicriTarihKisaIso8601": null,
    "HicriTarihUzun": "22 Recep 1447",
    "HicriTarihUzunIso8601": null,
    "AyinSekliURL": "https://namazvakti.diyanet.gov.tr/images/sd1.gif",
    "MiladiTarihKisa": "11.01.2026",
    "MiladiTarihKisaIso8601": "11.01.2026",
    "MiladiTarihUzun": "11 Ocak 2026 Pazar",
    "MiladiTarihUzunIso8601": "2026-01-11T00:00:00.0000000-11:00",
    "GreenwichOrtalamaZamani": 3.0,
    "Aksam": "19:10",
    "Gunes": "05:45",
    "GunesBatis": "19:03",
    "GunesDogus": "05:52",
    "Ikindi": "15:50",
    "Imsak": "04:30",
    "KibleSaati": "21:49",
    "Ogle": "12:32",
    "Yatsi": "20:20"
  },
  {
    "HicriTarihKisa": "23.7.1447",
    "HicriTarihKisaIso8601": null,
    "HicriTarihUzun": "23 Recep 1447",
    "HicriTarihUzunIso8601": null,
    "AyinSekliURL": "https://namazvakti.diyanet.gov.tr/images/sd2.gif",
    "MiladiTarihKisa": "12.01.2026",
    "MiladiTarihKisaIso8601": "12.01.2026",
    "MiladiTarihUzun": "12 Ocak 2026 Pazartesi",
    "MiladiTarihUzunIso8601": "2026-01-12T00:00:00.0000000-11:00",
    "GreenwichOrtalamaZamani": 3.0,
    "Aksam": "19:10",
    "Gunes": "05:45",
    "GunesBatis": "19:03",
    "GunesDogus": "05:52",
    "Ikindi": "15:50",
    "Imsak": "04:31",
    "KibleSaati": "21:59",
    "Ogle": "12:33",
    "Yatsi": "20:20"
  },
  {
    "HicriTarihKisa": "24.7.1447",
    "HicriTarihKisaIso8601": null,
    "HicriTarihUzun": "24 Recep 1447",
    "HicriTarihUzunIso8601": null,
    "AyinSekliURL": "https://namazvakti.diyanet.gov.tr/images/sd3.gif",
    "MiladiTarihKisa": "13.01.2026",
    "MiladiTarihKisaIso8601": "13.01.2026",
    "MiladiTarihUzun": "13 Ocak 2026 Salı",
    "MiladiTarihUzunIso8601": "2026-01-13T00:00:00.0000000-11:00",
    "GreenwichOrtalamaZamani": 3.0,
    "Aksam": "19:10",
    "Gunes": "05:46",
    "GunesBatis": "19:03",
    "GunesDogus": "05:53",
    "Ikindi": "15:50",
    "Imsak": "04:32",
    "KibleSaati": "22:14",
    "Ogle": "12:33",
    "Yatsi": "20:20"
  },
  {
    "HicriTarihKisa": "25.7.1447",
    "HicriTarihKisaIso8601": null,
    "HicriTarihUzun": "25 Recep 1447",
    "HicriTarihUzunIso8601": null,
    "AyinSekliURL": "https://namazvakti.diyanet.gov.tr/images/sd4.gif",
    "MiladiTarihKisa": "14.01.2026",
    "MiladiTarihKisaIso8601": "14.01.2026",
    "MiladiTarihUzun": "14 Ocak 2026 Çarşamba",
    "MiladiTarihUzunIso8601": "2026-01-14T00:00:00.0000000-11:00",
    "GreenwichOrtalamaZamani": 3.0,
    "Aksam": "19:10",
    "Gunes": "05:47",
    "GunesBatis": "19:03",
    "GunesDogus": "05:54",
    "Ikindi": "15:50",
    "Imsak": "04:32",
    "KibleSaati": "22:13",
    "Ogle": "12:34",
    "Yatsi": "20:20"
  },
  {
    "HicriTarihKisa": "26.7.1447",
    "HicriTarihKisaIso8601": null,
    "HicriTarihUzun": "26 Recep 1447",
    "HicriTarihUzunIso8601": null,
    "AyinSekliURL": "https://namazvakti.diyanet.gov.tr/images/sd5.gif",
    "MiladiTarihKisa": "15.01.2026",
    "MiladiTarihKisaIso8601": "15.01.2026",
    "MiladiTarihUzun": "15 Ocak 2026 Perşembe",
    "MiladiTarihUzunIso8601": "2026-01-15T00:00:00.0000000-11:00",
    "GreenwichOrtalamaZamani": 3.0,
    "Aksam": "19:11",
    "Gunes": "05:47",
    "GunesBatis": "19:04",
    "GunesDogus": "05:54",
    "Ikindi": "15:50",
    "Imsak": "04:33",
    "KibleSaati": "21:57",
    "Ogle": "12:34",
    "Yatsi": "20:20"
  },
  {
    "HicriTarihKisa": "27.7.1447",
    "HicriTarihKisaIso8601": null,
    "HicriTarihUzun": "27 Recep 1447",
    "HicriTarihUzunIso8601": null,
    "AyinSekliURL": "https://namazvakti.diyanet.gov.tr/images/sd6.gif",
    "MiladiTarihKisa": "16.01.2026",
    "MiladiTarihKisaIso8601": "16.01.2026",
    "MiladiTarihUzun": "16 Ocak 2026 Cuma",
    "MiladiTarihUzunIso8601": "2026-01-16T00:00:00.0000000-11:00",
    "GreenwichOrtalamaZamani": 3.0,
    "Aksam": "19:11",
    "Gunes": "05:48",
    "GunesBatis": "19:04",
    "GunesDogus": "05:55",
    "Ikindi": "15:49",
    "Imsak": "04:34",
    "KibleSaati": "21:46",
    "Ogle": "12:34",
    "Yatsi": "20:20"
  },
  {
    "HicriTarihKisa": "28.7.1447",
    "HicriTarihKisaIso8601": null,
    "HicriTarihUzun": "28 Recep 1447",
    "HicriTarihUzunIso8601": null,
    "AyinSekliURL": "https://namazvakti.diyanet.gov.tr/images/sd7.gif",
    "MiladiTarihKisa": "17.01.2026",
    "MiladiTarihKisaIso8601": "17.01.2026",
    "MiladiTarihUzun": "17 Ocak 2026 Cumartesi",
    "MiladiTarihUzunIso8601": "2026-01-17T00:00:00.0000000-11:00",
    "GreenwichOrtalamaZamani": 3.0,
    "Aksam": "19:11",
    "Gunes": "05:49",
    "GunesBatis": "19:04",
    "GunesDogus": "05:56",
    "Ikindi": "15:49",
    "Imsak": "04:35",
    "KibleSaati": "21:37",
    "Ogle": "12:35",
    "Yatsi": "20:20"
  },
  {
    "HicriTarihKisa": "29.7.1447",
    "HicriTarihKisaIso8601": null,
    "HicriTarihUzun": "29 Recep 1447",
    "HicriTarihUzunIso8601": null,
    "AyinSekliURL": "https://namazvakti.diyanet.gov.tr/images/ictima.gif",
    "MiladiTarihKisa": "18.01.2026",
    "MiladiTarihKisaIso8601": "18.01.2026",
    "MiladiTarihUzun": "18 Ocak 2026 Pazar",
    "MiladiTarihUzunIso8601": "2026-01-18T00:00:00.0000000-11:00",
    "GreenwichOrtalamaZamani": 3.0,
    "Aksam": "19:11",
    "Gunes": "05:49",
    "GunesBatis": "19:04",
    "GunesDogus": "05:56",
    "Ikindi": "15:49",
    "Imsak": "04:36",
    "KibleSaati": "21:29",
    "Ogle": "12:35",
    "Yatsi": "20:20"
  },
  {
    "HicriTarihKisa": "30.7.1447",
    "HicriTarihKisaIso8601": null,
    "HicriTarihUzun": "30 Recep 1447",
    "HicriTarihUzunIso8601": null,
    "AyinSekliURL": "https://namazvakti.diyanet.gov.tr/images/ruyet.gif",
    "MiladiTarihKisa": "19.01.2026",
    "MiladiTarihKisaIso8601": "19.01.2026",
    "MiladiTarihUzun": "19 Ocak 2026 Pazartesi",
    "MiladiTarihUzunIso8601": "2026-01-19T00:00:00.0000000-11:00",
    "GreenwichOrtalamaZamani": 3.0,
    "Aksam": "19:11",
    "Gunes": "05:50",
    "GunesBatis": "19:04",
    "GunesDogus": "05:57",
    "Ikindi": "15:49",
    "Imsak": "04:36",
    "KibleSaati": "21:21",
    "Ogle": "12:35",
    "Yatsi": "20:19"
  },
  {
    "HicriTarihKisa": "1.8.1447",
    "HicriTarihKisaIso8601": null,
    "HicriTarihUzun": "1 Şaban 1447",
    "HicriTarihUzunIso8601": null,
    "AyinSekliURL": "https://namazvakti.diyanet.gov.tr/images/r1.gif",
    "MiladiTarihKisa": "20.01.2026",
    "MiladiTarihKisaIso8601": "20.01.2026",
    "MiladiTarihUzun": "20 Ocak 2026 Salı",
    "MiladiTarihUzunIso8601": "2026-01-20T00:00:00.0000000-11:00",
    "GreenwichOrtalamaZamani": 3.0,
    "Aksam": "19:11",
    "Gunes": "05:51",
    "GunesBatis": "19:04",
    "GunesDogus": "05:58",
    "Ikindi": "15:49",
    "Imsak": "04:37",
    "KibleSaati": "21:14",
    "Ogle": "12:36",
    "Yatsi": "20:19"
  },
  {
    "HicriTarihKisa": "2.8.1447",
    "HicriTarihKisaIso8601": null,
    "HicriTarihUzun": "2 Şaban 1447",
    "HicriTarihUzunIso8601": null,
    "AyinSekliURL": "https://namazvakti.diyanet.gov.tr/images/r2.gif",
    "MiladiTarihKisa": "21.01.2026",
    "MiladiTarihKisaIso8601": "21.01.2026",
    "MiladiTarihUzun": "21 Ocak 2026 Çarşamba",
    "MiladiTarihUzunIso8601": "2026-01-21T00:00:00.0000000-11:00",
    "GreenwichOrtalamaZamani": 3.0,
    "Aksam": "19:10",
    "Gunes": "05:51",
    "GunesBatis": "19:03",
    "GunesDogus": "05:58",
    "Ikindi": "15:48",
    "Imsak": "04:38",
    "KibleSaati": "21:08",
    "Ogle": "12:36",
    "Yatsi": "20:19"
  },
  {
    "HicriTarihKisa": "3.8.1447",
    "HicriTarihKisaIso8601": null,
    "HicriTarihUzun": "3 Şaban 1447",
    "HicriTarihUzunIso8601": null,
    "AyinSekliURL": "https://namazvakti.diyanet.gov.tr/images/r3.gif",
    "MiladiTarihKisa": "22.01.2026",
    "MiladiTarihKisaIso8601": "22.01.2026",
    "MiladiTarihUzun": "22 Ocak 2026 Perşembe",
    "MiladiTarihUzunIso8601": "2026-01-22T00:00:00.0000000-11:00",
    "GreenwichOrtalamaZamani": 3.0,
    "Aksam": "19:10",
    "Gunes": "05:52",
    "GunesBatis": "19:03",
    "GunesDogus": "05:59",
    "Ikindi": "15:48",
    "Imsak": "04:39",
    "KibleSaati": "21:02",
    "Ogle": "12:36",
    "Yatsi": "20:19"
  },
  {
    "HicriTarihKisa": "4.8.1447",
    "HicriTarihKisaIso8601": null,
    "HicriTarihUzun": "4 Şaban 1447",
    "HicriTarihUzunIso8601": null,
    "AyinSekliURL": "https://namazvakti.diyanet.gov.tr/images/r4.gif",
    "MiladiTarihKisa": "23.01.2026",
    "MiladiTarihKisaIso8601": "23.01.2026",
    "MiladiTarihUzun": "23 Ocak 2026 Cuma",
    "MiladiTarihUzunIso8601": "2026-01-23T00:00:00.0000000-11:00",
    "GreenwichOrtalamaZamani": 3.0,
    "Aksam": "19:10",
    "Gunes": "05:53",
    "GunesBatis": "19:03",
    "GunesDogus": "06:00",
    "Ikindi": "15:48",
    "Imsak": "04:40",
    "KibleSaati": "20:56",
    "Ogle": "12:36",
    "Yatsi": "20:18"
  },
  {
    "HicriTarihKisa": "5.8.1447",
    "HicriTarihKisaIso8601": null,
    "HicriTarihUzun": "5 Şaban 1447",
    "HicriTarihUzunIso8601": null,
    "AyinSekliURL": "https://namazvakti.diyanet.gov.tr/images/r5.gif",
    "MiladiTarihKisa": "24.01.2026",
    "MiladiTarihKisaIso8601": "24.01.2026",
    "MiladiTarihUzun": "24 Ocak 2026 Cumartesi",
    "MiladiTarihUzunIso8601": "2026-01-24T00:00:00.0000000-11:00",
    "GreenwichOrtalamaZamani": 3.0,
    "Aksam": "19:10",
    "Gunes": "05:53",
    "GunesBatis": "19:03",
    "GunesDogus": "06:00",
    "Ikindi": "15:47",
    "Imsak": "04:40",
    "KibleSaati": "20:50",
    "Ogle": "12:37",
    "Yatsi": "20:18"
  },
  {
    "HicriTarihKisa": "6.8.1447",
    "HicriTarihKisaIso8601": null,
    "HicriTarihUzun": "6 Şaban 1447",
    "HicriTarihUzunIso8601": null,
    "AyinSekliURL": "https://namazvakti.diyanet.gov.tr/images/r6.gif",
    "MiladiTarihKisa": "25.01.2026",
    "MiladiTarihKisaIso8601": "25.01.2026",
    "MiladiTarihUzun": "25 Ocak 2026 Pazar",
    "MiladiTarihUzunIso8601": "2026-01-25T00:00:00.0000000-11:00",
    "GreenwichOrtalamaZamani": 3.0,
    "Aksam": "19:10",
    "Gunes": "05:54",
    "GunesBatis": "19:03",
    "GunesDogus": "06:01",
    "Ikindi": "15:47",
    "Imsak": "04:41",
    "KibleSaati": "20:44",
    "Ogle": "12:37",
    "Yatsi": "20:18"
  }
]