[
  {
    "HicriTarihKisa": "4.7.1447",
    "HicriTarihKisaIso8601": null,
    "HicriTarihUzun": "4 Recep 1447",
    "HicriTarihUzunIso8601": null,
    "AyinSekliURL": "https://namazvakti.diyanet.gov.tr/images/r4.gif",
    "MiladiTarihKisa": "24.12.2025",
    "MiladiTarihKisaIso8601": "24.12.2025",
    "MiladiTarihUzun": "24 Aralık 2025 Çarşamba",
    "MiladiTarihUzunIso8601": "2025-12-24T00:00:00.0000000+01:00",
    "GreenwichOrtalamaZamani": 3.0,
    "Aksam": "16:20",
    "Gunes": "07:45",
    "GunesBatis": "16:13",
    "GunesDogus": "07:52",
    "Ikindi": "14:00",
    "Imsak": "05:58",
    "KibleSaati": "08:35",
    "Ogle": "12:08",
    "Yatsi": "17:55"
  },
  {
    "HicriTarihKisa": "5.7.1447",
    "HicriTarihKisaIso8601": null,
    "HicriTarihUzun": "5 Recep 1447",
    "HicriTarihUzunIso8601": null,
    "AyinSekliURL": "https://namazvakti.diyanet.gov.tr/images/r5.gif",
    "MiladiTarihKisa": "25.12.2025",
    "MiladiTarihKisaIso8601": "25.12.2025",
    "MiladiTarihUzun": "25 Aralık 2025 Perşembe",
    "MiladiTarihUzunIso8601": "2025-12-25T00:00:00.0000000+01:00",
    "GreenwichOrtalamaZamani": 3.0,
    "Aksam": "16:20",
    "Gunes": "07:46",
    "GunesBatis": "16:13",
    "GunesDogus": "07:53",
    "Ikindi": "14:00",
    "Imsak": "05:58",
    "KibleSaati": "08:36",
    "Ogle": "12:08",
    "Yatsi": "17:55"
  },
  {
    "HicriTarihKisa": "6.7.1447",
    "HicriTarihKisaIso8601": null,
    "HicriTarihUzun": "6 Recep 1447",
    "HicriTarihUzunIso8601": null,
    "AyinSekliURL": "https://namazvakti.diyanet.gov.tr/images/r6.gif",
    "MiladiTarihKisa": "26.12.2025",
    "MiladiTarihKisaIso8601": "26.12.2025",
    "MiladiTarihUzun": "26 Aralık 2025 Cuma",
    "MiladiTarihUzunIso8601": "2025-12-26T00:00:00.0000000+01:00",
    "GreenwichOrtalamaZamani": 3.0,
    "Aksam": "16:21",
    "Gunes": "07:46",
    "GunesBatis": "16:14",
    "GunesDogus": "07:53",
    "Ikindi": "14:01",
    "Imsak": "05:59",
    "KibleSaati": "08:36",
    "Ogle": "12:08",
    "Yatsi": "17:56"
  },
  {
    "HicriTarihKisa": "7.7.1447",
    "HicriTarihKisaIso8601": null,
    "HicriTarihUzun": "7 Recep 1447",
    "HicriTarihUzunIso8601": null,
    "AyinSekliURL": "https://namazvakti.diyanet.gov.tr/images/ilkdordun.gif",
    "MiladiTarihKisa": "27.12.2025",
    "MiladiTarihKisaIso8601": "27.12.2025",
    "MiladiTarihUzun": "27 Aralık 2025 Cumartesi",
    "MiladiTarihUzunIso8601": "2025-12-27T00:00:00.0000000+01:00",
    "GreenwichOrtalamaZamani": 3.0,
    "Aksam": "16:22",
    "Gunes": "07:46",
    "GunesBatis": "16:15",
    "GunesDogus": "07:53",
    "Ikindi": "14:02",
    "Imsak": "05:59",
    "KibleSaati": "08:37",
    "Ogle": "12:09",
    "Yatsi": "17:57"
  },
  {
    "HicriTarihKisa": "8.7.1447",
    "HicriTarihKisaIso8601": null,
    "HicriTarihUzun": "8 Recep 1447",
    "HicriTarihUzunIso8601": null,
    "AyinSekliURL": "https://namazvakti.diyanet.gov.tr/images/i1.gif",
    "MiladiTarihKisa": "28.12.2025",
    "MiladiTarihKisaIso8601": "28.12.2025",
    "MiladiTarihUzun": "28 Aralık 2025 Pazar",
    "MiladiTarihUzunIso8601": "2025-12-28T00:00:00.0000000+01:00",
    "GreenwichOrtalamaZamani": 3.0,
    "Aksam": "16:22",
    "Gunes": "07:46",
    "GunesBatis": "16:15",
    "GunesDogus": "07:53",
    "Ikindi": "14:02",
    "Imsak": "05:59",
    "KibleSaati": "08:37",
    "Ogle": "12:09",
    "Yatsi": "17:57"
  },
  {
    "HicriTarihKisa": "9.7.1447",
    "HicriTarihKisaIso8601": null,
    "HicriTarihUzun": "9 Recep 1447",
    "HicriTarihUzunIso8601": null,
    "AyinSekliURL": "https://namazvakti.diyanet.gov.tr/images/i2.gif",
    "MiladiTarihKisa": "29.12.2025",
    "MiladiTarihKisaIso8601": "29.12.2025",
    "MiladiTarihUzun": "29 Aralık 2025 Pazartesi",
    "MiladiTarihUzunIso8601": "2025-12-29T00:00:00.0000000+01:00",
    "GreenwichOrtalamaZamani": 3.0,
    "Aksam": "16:23",
    "Gunes": "07:47",
    "GunesBatis": "16:16",
    "GunesDogus": "07:54",
    "Ikindi": "14:03",
    "Imsak": "05:59",
    "KibleSaati": "08:38",
    "Ogle": "12:10",
    "Yatsi": "17:58"
  },
  {
    "HicriTarihKisa": "10.7.1447",
    "HicriTarihKisaIso8601": null,
    "HicriTarihUzun": "10 Recep 1447",
    "HicriTarihUzunIso8601": null,
    "AyinSekliURL": "https://namazvakti.diyanet.gov.tr/images/i3.gif",
    "MiladiTarihKisa": "30.12.2025",
    "MiladiTarihKisaIso8601": "30.12.2025",
    "MiladiTarihUzun": "30 Aralık 2025 Salı",
    "MiladiTarihUzunIso8601": "2025-12-30T00:00:00.0000000+01:00",
    "GreenwichOrtalamaZamani": 3.0,
    "Aksam": "16:24",
    "Gunes": "07:47",
    "GunesBatis": "16:17",
    "GunesDogus": "07:54",
    "Ikindi": "14:04",
    "Imsak": "06:00",
    "KibleSaati": "08:39",
    "Ogle": "12:10",
    "Yatsi": "17:59"
  },
  {
    "HicriTarihKisa": "11.7.1447",
    "HicriTarihKisaIso8601": null,
    "HicriTarihUzun": "11 Recep 1447",
    "HicriTarihUzunIso8601": null,
    "AyinSekliURL": "https://namazvakti.diyanet.gov.tr/images/i4.gif",
    "MiladiTarihKisa": "31.12.2025",
    "MiladiTarihKisaIso8601": "31.12.2025",
    "MiladiTarihUzun": "31 Aralık 2025 Çarşamba",
    "MiladiTarihUzunIso8601": "2025-12-31T00:00:00.0000000+01:00",
    "GreenwichOrtalamaZamani": 3.0,
    "Aksam": "16:25",
    "Gunes": "07:47",
    "GunesBatis": "16:18",
    "GunesDogus": "07:54",
    "Ikindi": "14:05",
    "Imsak": "06:00",
    "KibleSaati": "08:39",
    "Ogle": "12:11",
    "Yatsi": "18:00"
  },
  {
    "HicriTarihKisa": "12.7.1447",
    "HicriTarihKisaIso8601": null,
    "HicriTarihUzun": "12 Recep 1447",
    "HicriTarihUzunIso8601": null,
    "AyinSekliURL": "https://namazvakti.diyanet.gov.tr/images/i6.gif",
    "MiladiTarihKisa": "01.01.2026",
    "MiladiTarihKisaIso8601": "01.01.2026",
    "MiladiTarihUzun": "01 Ocak 2026 Perşembe",
    "MiladiTarihUzunIso8601": "2026-01-01T00:00:00.0000000+01:00",
    "GreenwichOrtalamaZamani": 3.0,
    "Aksam": "16:26",
    "Gunes": "07:47",
    "GunesBatis": "16:19",
    "GunesDogus": "07:54",
    "Ikindi": "14:06",
    "Imsak": "06:00",
    "KibleSaati": "08:40",
    "Ogle": "12:11",
    "Yatsi": "18:00"
  },
  {
    "HicriTarihKisa": "13.7.1447",
    "HicriTarihKisaIso8601": null,
    "HicriTarihUzun": "13 Recep 1447",
    "HicriTarihUzunIso8601": null,
    "AyinSekliURL": "https://namazvakti.diyanet.gov.tr/images/i7.gif",
    "MiladiTarihKisa": "02.01.2026",
    "MiladiTarihKisaIso8601": "02.01.2026",
    "MiladiTarihUzun": "02 Ocak 2026 Cuma",
    "MiladiTarihUzunIso8601": "2026-01-02T00:00:00.0000000+01:00",
    "GreenwichOrtalamaZamani": 3.0,
    "Aksam": "16:27",
    "Gunes": "07:47",
    "GunesBatis": "16:20",
    "GunesDogus": "07:54",
    "Ikindi": "14:06",
    "Imsak": "06:00",
    "KibleSaati": "08:41",
    "Ogle": "12:12",
    "Yatsi": "18:01"
  },
  {
    "HicriTarihKisa": "14.7.1447",
    "HicriTarihKisaIso8601": null,
    "HicriTarihUzun": "14 Recep 1447",
    "HicriTarihUzunIso8601": null,
    "AyinSekliURL": "https://namazvakti.diyanet.gov.tr/images/dolunay.gif",
    "MiladiTarihKisa": "03.01.2026",
    "MiladiTarihKisaIso8601": "03.01.2026",
    "MiladiTarihUzun": "03 Ocak 2026 Cumartesi",
    "MiladiTarihUzunIso8601": "2026-01-03T00:00:00.0000000+01:00",
    "GreenwichOrtalamaZamani": 3.0,
    "Aksam": "16:28",
    "Gunes": "07:47",
    "GunesBatis": "16:21",
    "GunesDogus": "07:54",
    "Ikindi": "14:07",
    "Imsak": "06:00",
    "KibleSaati": "08:41",
    "Ogle": "12:12",
    "Yatsi": "18:02"
  },
  {
    "HicriTarihKisa": "15.7.1447",
    "HicriTarihKisaIso8601": null,
    "HicriTarihUzun": "15 Recep 1447",
    "HicriTarihUzunIso8601": null,
    "AyinSekliURL": "https://namazvakti.diyanet.gov.tr/images/d1.gif",
    "MiladiTarihKisa": "04.01.2026",
    "MiladiTarihKisaIso8601": "04.01.2026",
    "MiladiTarihUzun": "04 Ocak 2026 Pazar",
    "MiladiTarihUzunIso8601": "2026-01-04T00:00:00.0000000+01:00",
    "GreenwichOrtalamaZamani": 3.0,
    "Aksam": "16:29",
    "Gunes": "07:47",
    "GunesBatis": "16:22",
    "GunesDogus": "07:54",
    "Ikindi": "14:08",
    "Imsak": "06:00",
    "KibleSaati": "08:42",
    "Ogle": "12:13",
    "Yatsi": "18:03"
  },
  {
    "HicriTarihKisa": "16.7.1447",
    "HicriTarihKisaIso8601": null,
    "HicriTarihUzun": "16 Recep 1447",
    "HicriTarihUzunIso8601": null,
    "AyinSekliURL": "https://namazvakti.diyanet.gov.tr/images/d2.gif",
    "MiladiTarihKisa": "05.01.2026",
    "MiladiTarihKisaIso8601": "05.01.2026",
    "MiladiTarihUzun": "05 Ocak 2026 Pazartesi",
    "MiladiTarihUzunIso8601": "2026-01-05T00:00:00.0000000+01:00",
    "GreenwichOrtalamaZamani": 3.0,
    "Aksam": "16:30",
    "Gunes": "07:46",
    "GunesBatis": "16:23",
    "GunesDogus": "07:53",
    "Ikindi": "14:09",
    "Imsak": "06:00",
    "KibleSaati": "08:43",
    "Ogle": "12:13",
    "Yatsi": "18:04"
  },
  {
    "HicriTarihKisa": "17.7.1447",
    "HicriTarihKisaIso8601": null,
    "HicriTarihUzun": "17 Recep 1447",
    "HicriTarihUzunIso8601": null,
    "AyinSekliURL": "https://namazvakti.diyanet.gov.tr/images/d3.gif",
    "MiladiTarihKisa": "06.01.2026",
    "MiladiTarihKisaIso8601": "06.01.2026",
    "MiladiTarihUzun": "06 Ocak 2026 Salı",
    "MiladiTarihUzunIso8601": "2026-01-06T00:00:00.0000000+01:00",
    "GreenwichOrtalamaZamani": 3.0,
    "Aksam": "16:31",
    "Gunes": "07:46",
    "GunesBatis": "16:24",
    "GunesDogus": "07:53",
    "Ikindi": "14:10",
    "Imsak": "06:00",
    "KibleSaati": "08:44",
    "Ogle": "12:14",
    "Yatsi": "18:05"
  },
  {
    "HicriTarihKisa": "18.7.1447",
    "HicriTarihKisaIso8601": null,
    "HicriTarihUzun": "18 Recep 1447",
    "HicriTarihUzunIso8601": null,
    "AyinSekliURL": "https://namazvakti.diyanet.gov.tr/images/d4.gif",
    "MiladiTarihKisa": "07.01.2026",
    "MiladiTarihKisaIso8601": "07.01.2026",
    "MiladiTarihUzun": "07 Ocak 2026 Çarşamba",
    "MiladiTarihUzunIso8601": "2026-01-07T00:00:00.0000000+01:00",
    "GreenwichOrtalamaZamani": 3.0,
    "Aksam": "16:32",
    "Gunes": "07:46",
    "GunesBatis": "16:25",
    "GunesDogus": "07:53",
    "Ikindi": "14:11",
    "Imsak": "06:00",
    "KibleSaati": "08:44",
    "Ogle": "12:14",
    "Yatsi": "18:06"
  },
  {
    "HicriTarihKisa": "19.7.1447",
    "HicriTarihKisaIso8601": null,
    "HicriTarihUzun": "19 Recep 1447",
    "HicriTarihUzunIso8601": null,
    "AyinSekliURL": "https://namazvakti.diyanet.gov.tr/images/d5.gif",
    "MiladiTarihKisa": "08.01.2026",
    "MiladiTarihKisaIso8601": "08.01.2026",
    "MiladiTarihUzun": "08 Ocak 2026 Perşembe",
    "MiladiTarihUzunIso8601": "2026-01-08T00:00:00.0000000+01:00",
    "GreenwichOrtalamaZamani": 3.0,
    "Aksam": "16:33",
    "Gunes": "07:46",
    "GunesBatis": "16:26",
    "GunesDogus": "07:53",
    "Ikindi": "14:12",
    "Imsak": "06:00",
    "KibleSaati": "08:45",
    "Ogle": "12:15",
    "Yatsi": "18:07"
  },
  {
    "HicriTarihKisa": "20.7.1447",
    "HicriTarihKisaIso8601": null,
    "HicriTarihUzun": "20 Recep 1447",
    "HicriTarihUzunIso8601": null,
    "AyinSekliURL": "https://namazvakti.diyanet.gov.tr/images/d6.gif",
    "MiladiTarihKisa": "09.01.2026",
    "MiladiTarihKisaIso8601": "09.01.2026",
    "MiladiTarihUzun": "09 Ocak 2026 Cuma",
    "MiladiTarihUzunIso8601": "2026-01-09T00:00:00.0000000+01:00",
    "GreenwichOrtalamaZamani": 3.0,
    "Aksam": "16:35",
    "Gunes": "07:45",
    "GunesBatis": "16:28",
    "GunesDogus": "07:52",
    "Ikindi": "14:13",
    "Imsak": "06:00",
    "KibleSaati": "08:46",
    "Ogle": "12:15",
    "Yatsi": "18:08"
  },
  {
    "HicriTarihKisa": "21.7.1447",
    "HicriTarihKisaIso8601": null,
    "HicriTarihUzun": "21 Recep 1447",
    "HicriTarihUzunIso8601": null,
    "AyinSekliURL": "https://namazvakti.diyanet.gov.tr/images/sondordun.gif",
    "MiladiTarihKisa": "10.01.2026",
    "MiladiTarihKisaIso8601": "10.01.2026",
    "MiladiTarihUzun": "10 Ocak 2026 Cumartesi",
    "MiladiTarihUzunIso8601": "2026-01-10T00:00:00.0000000+01:00",
    "GreenwichOrtalamaZamani": 3.0,
    "Aksam": "16:36",
    "Gunes": "07:45",
    "GunesBatis": "16:29",
    "GunesDogus": "07:52",
    "Ikindi": "14:14",
    "Imsak": "05:59",
    "KibleSaati": "08:47",
    "Ogle": "12:15",
    "Yatsi": "18:09"
  },
  {
    "HicriTarihKisa": "22.7.1447",
    "HicriTarihKisaIso8601": null,
    "HicriTarihUzun": "22 Recep 1447",
    "HicriTarihUzunIso8601": null,
    "AyinSekliURL": "https://namazvakti.diyanet.gov.tr/images/sd1.gif",
    "MiladiTarihKisa": "11.01.2026",
    "MiladiTarihKisaIso8601": "11.01.2026",
    "MiladiTarihUzun": "11 Ocak 2026 Pazar",
    "MiladiTarihUzunIso8601": "2026-01-11T00:00:00.0000000+01:00",
    "GreenwichOrtalamaZamani": 3.0,
    "Aksam": "16:37",
    "Gunes": "07:44",
    "GunesBatis": "16:30",
    "GunesDogus": "07:51",
    "Ikindi": "14:15",
    "Imsak": "05:59",
    "KibleSaati": "08:48",
    "Ogle": "12:16",
    "Yatsi": "18:10"
  },
  {
    "HicriTarihKisa": "23.7.1447",
    "HicriTarihKisaIso8601": null,
    "HicriTarihUzun": "23 Recep 1447",
    "HicriTarihUzunIso8601": null,
    "AyinSekliURL": "https://namazvakti.diyanet.gov.tr/images/sd2.gif",
    "MiladiTarihKisa": "12.01.2026",
    "MiladiTarihKisaIso8601": "12.01.2026",
    "MiladiTarihUzun": "12 Ocak 2026 Pazartesi",
    "MiladiTarihUzunIso8601": "2026-01-12T00:00:00.0000000+01:00",
    "GreenwichOrtalamaZamani": 3.0,
    "Aksam": "16:38",
    "Gunes": "07:44",
    "GunesBatis": "16:31",
    "GunesDogus": "07:51",
    "Ikindi": "14:17",
    "Imsak": "05:59",
    "KibleSaati": "08:48",
    "Ogle": "12:16",
    "Yatsi": "18:11"
  },
  {
    "HicriTarihKisa": "24.7.1447",
    "HicriTarihKisaIso8601": null,
    "HicriTarihUzun": "24 Recep 1447",
    "HicriTarihUzunIso8601": null,
    "AyinSekliURL": "https://namazvakti.diyanet.gov.tr/images/sd3.gif",
    "MiladiTarihKisa": "13.01.2026",
    "MiladiTarihKisaIso8601": "13.01.2026",
    "MiladiTarihUzun": "13 Ocak 2026 Salı",
    "MiladiTarihUzunIso8601": "2026-01-13T00:00:00.0000000+01:00",
    "GreenwichOrtalamaZamani": 3.0,
    "Aksam": "16:40",
    "Gunes": "07:43",
    "GunesBatis": "16:33",
    "GunesDogus": "07:50",
    "Ikindi": "14:18",
    "Imsak": "05:58",
    "KibleSaati": "08:49",
    "Ogle": "12:17",
    "Yatsi": "18:12"
  },
  {
    "HicriTarihKisa": "25.7.1447",
    "HicriTarihKisaIso8601": null,
    "HicriTarihUzun": "25 Recep 1447",
    "HicriTarihUzunIso8601": null,
    "AyinSekliURL": "https://namazvakti.diyanet.gov.tr/images/sd4.gif",
    "MiladiTarihKisa": "14.01.2026",
    "MiladiTarihKisaIso8601": "14.01.2026",
    "MiladiTarihUzun": "14 Ocak 2026 Çarşamba",
    "MiladiTarihUzunIso8601": "2026-01-14T00:00:00.0000000+01:00",
    "GreenwichOrtalamaZamani": 3.0,
    "Aksam": "16:41",
    "Gunes": "07:43",
    "GunesBatis": "16:34",
    "GunesDogus": "07:50",
    "Ikindi": "14:19",
    "Imsak": "05:58",
    "KibleSaati": "08:50",
    "Ogle": "12:17",
    "Yatsi": "18:14"
  },
  {
    "HicriTarihKisa": "26.7.1447",
    "HicriTarihKisaIso8601": null,
    "HicriTarihUzun": "26 Recep 1447",
    "HicriTarihUzunIso8601": null,
    "AyinSekliURL": "https://namazvakti.diyanet.gov.tr/images/sd5.gif",
    "MiladiTarihKisa": "15.01.2026",
    "MiladiTarihKisaIso8601": "15.01.2026",
    "MiladiTarihUzun": "15 Ocak 2026 Perşembe",
    "MiladiTarihUzunIso8601": "2026-01-15T00:00:00.0000000+01:00",
    "GreenwichOrtalamaZamani": 3.0,
    "Aksam": "16:43",
    "Gunes": "07:42",
    "GunesBatis": "16:36",
    "GunesDogus": "07:49",
    "Ikindi": "14:20",
    "Imsak": "05:58",
    "KibleSaati": "08:51",
    "Ogle": "12:17",
    "Yatsi": "18:15"
  },
  {
    "HicriTarihKisa": "27.7.1447",
    "HicriTarihKisaIso8601": null,
    "HicriTarihUzun": "27 Recep 1447",
    "HicriTarihUzunIso8601": null,
    "AyinSekliURL": "https://namazvakti.diyanet.gov.tr/images/sd6.gif",
    "MiladiTarihKisa": "16.01.2026",
    "MiladiTarihKisaIso8601": "16.01.2026",
    "MiladiTarihUzun": "16 Ocak 2026 Cuma",
    "MiladiTarihUzunIso8601": "2026-01-16T00:00:00.0000000+01:00",
    "GreenwichOrtalamaZamani": 3.0,
    "Aksam": "16:44",
    "Gunes": "07:41",
    "GunesBatis": "16:37",
    "GunesDogus": "07:48",
    "Ikindi": "14:21",
    "Imsak": "05:57",
    "KibleSaati": "08:52",
    "Ogle": "12:18",
    "Yatsi": "18:16"
  },
  {
    "HicriTarihKisa": "28.7.1447",
    "HicriTarihKisaIso8601": null,
    "HicriTarihUzun": "28 Recep 1447",
    "HicriTarihUzunIso8601": null,
    "AyinSekliURL": "https://namazvakti.diyanet.gov.tr/images/sd7.gif",
    "MiladiTarihKisa": "17.01.2026",
    "MiladiTarihKisaIso8601": "17.01.2026",
    "MiladiTarihUzun": "17 Ocak 2026 Cumartesi",
    "MiladiTarihUzunIso8601": "2026-01-17T00:00:00.0000000+01:00",
    "GreenwichOrtalamaZamani": 3.0,
    "Aksam": "16:45",
    "Gunes": "07:41",
    "GunesBatis": "16:38",
    "GunesDogus": "07:48",
    "Ikindi": "14:22",
    "Imsak": "05:57",
    "KibleSaati": "08:52",
    "Ogle": "12:18",
    "Yatsi": "18:17"
  },
  {
    "HicriTarihKisa": "29.7.1447",
    "HicriTarihKisaIso8601": null,
    "HicriTarihUzun": "29 Recep 1447",
    "HicriTarihUzunIso8601": null,
    "AyinSekliURL": "https://namazvakti.diyanet.gov.tr/images/ictima.gif",
    "MiladiTarihKisa": "18.01.2026",
    "MiladiTarihKisaIso8601": "18.01.2026",
    "MiladiTarihUzun": "18 Ocak 2026 Pazar",
    "MiladiTarihUzunIso8601": "2026-01-18T00:00:00.0000000+01:00",
    "GreenwichOrtalamaZamani": 3.0,
    "Aksam": "16:47",
    "Gunes": "07:40",
    "GunesBatis": "16:40",
    "GunesDogus": "07:47",
    "Ikindi": "14:24",
    "Imsak": "05:56",
    "KibleSaati": "08:53",
    "Ogle": "12:18",
    "Yatsi": "18:18"
  },
  {
    "HicriTarihKisa": "30.7.1447",
    "HicriTarihKisaIso8601": null,
    "HicriTarihUzun": "30 Recep 1447",
    "HicriTarihUzunIso8601": null,
    "AyinSekliURL": "https://namazvakti.diyanet.gov.tr/images/ruyet.gif",
    "MiladiTarihKisa": "19.01.2026",
    "MiladiTarihKisaIso8601": "19.01.2026",
    "MiladiTarihUzun": "19 Ocak 2026 Pazartesi",
    "MiladiTarihUzunIso8601": "2026-01-19T00:00:00.0000000+01:00",
    "GreenwichOrtalamaZamani": 3.0,
    "Aksam": "16:48",
    "Gunes": "07:39",
    "GunesBatis": "16:41",
    "GunesDogus": "07:46",
    "Ikindi": "14:25",
    "Imsak": "05:56",
    "KibleSaati": "08:54",
    "Ogle": "12:19",
    "Yatsi": "18:20"
  },
  {
    "HicriTarihKisa": "1.8.1447",
    "HicriTarihKisaIso8601": null,
    "HicriTarihUzun": "1 Şaban 1447",
    "HicriTarihUzunIso8601": null,
    "AyinSekliURL": "https://namazvakti.diyanet.gov.tr/images/r1.gif",
    "MiladiTarihKisa": "20.01.2026",
    "MiladiTarihKisaIso8601": "20.01.2026",
    "MiladiTarihUzun": "20 Ocak 2026 Salı",
    "MiladiTarihUzunIso8601": "2026-01-20T00:00:00.0000000+01:00",
    "GreenwichOrtalamaZamani": 3.0,
    "Aksam": "16:50",
    "Gunes": "07:38",
    "GunesBatis": "16:43",
    "GunesDogus": "07:45",
    "Ikindi": "14:26",
    "Imsak": "05:55",
    "KibleSaati": "08:55",
    "Ogle": "12:19",
    "Yatsi": "18:21"
  },
  {
    "HicriTarihKisa": "2.8.1447",
    "HicriTarihKisaIso8601": null,
    "HicriTarihUzun": "2 Şaban 1447",
    "HicriTarihUzunIso8601": null,
    "AyinSekliURL": "https://namazvakti.diyanet.gov.tr/images/r2.gif",
    "MiladiTarihKisa": "21.01.2026",
    "MiladiTarihKisaIso8601": "21.01.2026",
    "MiladiTarihUzun": "21 Ocak 2026 Çarşamba",
    "MiladiTarihUzunIso8601": "2026-01-21T00:00:00.0000000+01:00",
    "GreenwichOrtalamaZamani": 3.0,
    "Aksam": "16:51",
    "Gunes": "07:37",
    "GunesBatis": "16:44",
    "GunesDogus": "07:44",
    "Ikindi": "14:27",
    "Imsak": "05:54",
    "KibleSaati": "08:56",
    "Ogle": "12:19",
    "Yatsi": "18:22"
  },
  {
    "HicriTarihKisa": "3.8.1447",
    "HicriTarihKisaIso8601": null,
    "HicriTarihUzun": "3 Şaban 1447",
    "HicriTarihUzunIso8601": null,
    "AyinSekliURL": "https://namazvakti.diyanet.gov.tr/images/r3.gif",
    "MiladiTarihKisa": "22.01.2026",
    "MiladiTarihKisaIso8601": "22.01.2026",
    "MiladiTarihUzun": "22 Ocak 2026 Perşembe",
    "MiladiTarihUzunIso8601": "2026-01-22T00:00:00.0000000+01:00",
    "GreenwichOrtalamaZamani": 3.0,
    "Aksam": "16:53",
    "Gunes": "07:36",
    "GunesBatis": "16:46",
    "GunesDogus": "07:43",
    "Ikindi": "14:29",
    "Imsak": "05:54",
    "KibleSaati": "08:57",
    "Ogle": "12:20",
    "Yatsi": "18:23"
  },
  {
    "HicriTarihKisa": "4.8.1447",
    "HicriTarihKisaIso8601": null,
    "HicriTarihUzun": "4 Şaban 1447",
    "HicriTarihUzunIso8601": null,
    "AyinSekliURL": "https://namazvakti.diyanet.gov.tr/images/r4.gif",
    "MiladiTarihKisa": "23.01.2026",
    "MiladiTarihKisaIso8601": "23.01.2026",
    "MiladiTarihUzun": "23 Ocak 2026 Cuma",
    "MiladiTarihUzunIso8601": "2026-01-23T00:00:00.0000000+01:00",
    "GreenwichOrtalamaZamani": 3.0,
    "Aksam": "16:54",
    "Gunes": "07:35",
    "GunesBatis": "16:47",
    "GunesDogus": "07:42",
    "Ikindi": "14:30",
    "Imsak": "05:53",
    "KibleSaati": "08:58",
    "Ogle": "12:20",
    "Yatsi": "18:25"
  },
  {
    "HicriTarihKisa": "5.8.1447",
    "HicriTarihKisaIso8601": null,
    "HicriTarihUzun": "5 Şaban 1447",
    "HicriTarihUzunIso8601": null,
    "AyinSekliURL": "https://namazvakti.diyanet.gov.tr/images/r5.gif",
    "MiladiTarihKisa": "24.01.2026",
    "MiladiTarihKisaIso8601": "24.01.2026",
    "MiladiTarihUzun": "24 Ocak 2026 Cumartesi",
    "MiladiTarihUzunIso8601": "2026-01-24T00:00:00.0000000+01:00",
    "GreenwichOrtalamaZamani": 3.0,
    "Aksam": "16:56",
    "Gunes": "07:34",
    "GunesBatis": "16:49",
    "GunesDogus": "07:41",
    "Ikindi": "14:31",
    "Imsak": "05:52",
    "KibleSaati": "08:58",
    "Ogle": "12:20",
    "Yatsi": "18:26"
  }
]