[
  {
    "HicriTarihKisa": "29.6.1447",
    "HicriTarihKisaIso8601": null,
    "HicriTarihUzun": "29 Cemaziyelahir 1447",
    "HicriTarihUzunIso8601": null,
    "AyinSekliURL": "https://namazvakti.diyanet.gov.tr/images/sd7.gif",
    "MiladiTarihKisa": "19.12.2025",
    "MiladiTarihKisaIso8601": "19.12.2025",
    "MiladiTarihUzun": "19 Aralık 2025 Cuma",
    "MiladiTarihUzunIso8601": "2025-12-19T00:00:00.0000000+03:00",
    "GreenwichOrtalamaZamani": 3.0,
    "Aksam": "18:00",
    "Gunes": "08:13",
    "GunesBatis": "17:53",
    "GunesDogus": "08:20",
    "Ikindi": "15:39",
    "Imsak": "06:46",
    "KibleSaati": "10:37",
    "Ogle": "13:12",
    "Yatsi": "19:22"
  },
  {
    "HicriTarihKisa": "30.6.1447",
    "HicriTarihKisaIso8601": null,
    "HicriTarihUzun": "30 Cemaziyelahir 1447",
    "HicriTarihUzunIso8601": null,
    "AyinSekliURL": "https://namazvakti.diyanet.gov.tr/images/ruyet.gif",
    "MiladiTarihKisa": "20.12.2025",
    "MiladiTarihKisaIso8601": "20.12.2025",
    "MiladiTarihUzun": "20 Aralık 2025 Cumartesi",
    "MiladiTarihUzunIso8601": "2025-12-20T00:00:00.0000000+03:00",
    "GreenwichOrtalamaZamani": 3.0,
    "Aksam": "18:00",
    "Gunes": "08:14",
    "GunesBatis": "17:53",
    "GunesDogus": "08:21",
    "Ikindi": "15:40",
    "Imsak": "06:47",
    "KibleSaati": "10:38",
    "Ogle": "13:12",
    "Yatsi": "19:22"
  },
  {
    "HicriTarihKisa": "1.7.1447",
    "HicriTarihKisaIso8601": null,
    "HicriTarihUzun": "1 Recep 1447",
    "HicriTarihUzunIso8601": null,
    "AyinSekliURL": "https://namazvakti.diyanet.gov.tr/images/r1.gif",
    "MiladiTarihKisa": "21.12.2025",
    "MiladiTarihKisaIso8601": "21.12.2025",
    "MiladiTarihUzun": "21 Aralık 2025 Pazar",
    "MiladiTarihUzunIso8601": "2025-12-21T00:00:00.0000000+03:00",
    "GreenwichOrtalamaZamani": 3.0,
    "Aksam": "18:01",
    "Gunes": "08:15",
    "GunesBatis": "17:54",
    "GunesDogus": "08:22",
    "Ikindi": "15:40",
    "Imsak": "06:47",
    "KibleSaati": "10:38",
    "Ogle": "13:13",
    "Yatsi": "19:23"
  },
  {
    "HicriTarihKisa": "2.7.1447",
    "HicriTarihKisaIso8601": null,
    "HicriTarihUzun": "2 Recep 1447",
    "HicriTarihUzunIso8601": null,
    "AyinSekliURL": "https://namazvakti.diyanet.gov.tr/images/r2.gif",
    "MiladiTarihKisa": "22.12.2025",
    "MiladiTarihKisaIso8601": "22.12.2025",
    "MiladiTarihUzun": "22 Aralık 2025 Pazartesi",
    "MiladiTarihUzunIso8601": "2025-12-22T00:00:00.0000000+03:00",
    "GreenwichOrtalamaZamani": 3.0,
    "Aksam": "18:01",
    "Gunes": "08:15",
    "GunesBatis": "17:54",
    "GunesDogus": "08:22",
    "Ikindi": "15:41",
    "Imsak": "06:48",
    "KibleSaati": "10:39",
    "Ogle": "13:13",
    "Yatsi": "19:23"
  },
  {
    "HicriTarihKisa": "3.7.1447",
    "HicriTarihKisaIso8601": null,
    "HicriTarihUzun": "3 Recep 1447",
    "HicriTarihUzunIso8601": null,
    "AyinSekliURL": "https://namazvakti.diyanet.gov.tr/images/r3.gif",
    "MiladiTarihKisa": "23.12.2025",
    "MiladiTarihKisaIso8601": "23.12.2025",
    "MiladiTarihUzun": "23 Aralık 2025 Salı",
    "MiladiTarihUzunIso8601": "2025-12-23T00:00:00.0000000+03:00",
    "GreenwichOrtalamaZamani": 3.0,
    "Aksam": "18:02",
    "Gunes": "08:16",
    "GunesBatis": "17:55",
    "GunesDogus": "08:23",
    "Ikindi": "15:41",
    "Imsak": "06:48",
    "KibleSaati": "10:39",
    "Ogle": "13:14",
    "Yatsi": "19:24"
  },
  {
    "HicriTarihKisa": "4.7.1447",
    "HicriTarihKisaIso8601": null,
    "HicriTarihUzun": "4 Recep 1447",
    "HicriTarihUzunIso8601": null,
    "AyinSekliURL": "https://namazvakti.diyanet.gov.tr/images/r4.gif",
    "MiladiTarihKisa": "24.12.2025",
    "MiladiTarihKisaIso8601": "24.12.2025",
    "MiladiTarihUzun": "24 Aralık 2025 Çarşamba",
    "MiladiTarihUzunIso8601": "2025-12-24T00:00:00.0000000+03:00",
    "GreenwichOrtalamaZamani": 3.0,
    "Aksam": "18:02",
    "Gunes": "08:16",
    "GunesBatis": "17:55",
    "GunesDogus": "08:23",
    "Ikindi": "15:42",
    "Imsak": "06:48",
    "KibleSaati": "10:40",
    "Ogle": "13:14",
    "Yatsi": "19:24"
  },
  {
    "HicriTarihKisa": "5.7.1447",
    "HicriTarihKisaIso8601": null,
    "HicriTarihUzun": "5 Recep 1447",
    "HicriTarihUzunIso8601": null,
    "AyinSekliURL": "https://namazvakti.diyanet.gov.tr/images/r5.gif",
    "MiladiTarihKisa": "25.12.2025",
    "MiladiTarihKisaIso8601": "25.12.2025",
    "MiladiTarihUzun": "25 Aralık 2025 Perşembe",
    "MiladiTarihUzunIso8601": "2025-12-25T00:00:00.0000000+03:00",
    "GreenwichOrtalamaZamani": 3.0,
    "Aksam": "18:03",
    "Gunes": "08:16",
    "GunesBatis": "17:56",
    "GunesDogus": "08:23",
    "Ikindi": "15:42",
    "Imsak": "06:49",
    "KibleSaati": "10:40",
    "Ogle": "13:15",
    "Yatsi": "19:25"
  },
  {
    "HicriTarihKisa": "6.7.1447",
    "HicriTarihKisaIso8601": null,
    "HicriTarihUzun": "6 Recep 1447",
    "HicriTarihUzunIso8601": null,
    "AyinSekliURL": "https://namazvakti.diyanet.gov.tr/images/r6.gif",
    "MiladiTarihKisa": "26.12.2025",
    "MiladiTarihKisaIso8601": "26.12.2025",
    "MiladiTarihUzun": "26 Aralık 2025 Cuma",
    "MiladiTarihUzunIso8601": "2025-12-26T00:00:00.0000000+03:00",
    "GreenwichOrtalamaZamani": 3.0,
    "Aksam": "18:03",
    "Gunes": "08:17",
    "GunesBatis": "17:56",
    "GunesDogus": "08:24",
    "Ikindi": "15:43",
    "Imsak": "06:49",
    "KibleSaati": "10:41",
    "Ogle": "13:15",
    "Yatsi": "19:26"
  },
  {
    "HicriTarihKisa": "7.7.1447",
    "HicriTarihKisaIso8601": null,
    "HicriTarihUzun": "7 Recep 1447",
    "HicriTarihUzunIso8601": null,
    "AyinSekliURL": "https://namazvakti.diyanet.gov.tr/images/ilkdordun.gif",
    "MiladiTarihKisa": "27.12.2025",
    "MiladiTarihKisaIso8601": "27.12.2025",
    "MiladiTarihUzun": "27 Aralık 2025 Cumartesi",
    "MiladiTarihUzunIso8601": "2025-12-27T00:00:00.0000000+03:00",
    "GreenwichOrtalamaZamani": 3.0,
    "Aksam": "18:04",
    "Gunes": "08:17",
    "GunesBatis": "17:57",
    "GunesDogus": "08:24",
    "Ikindi": "15:43",
    "Imsak": "06:50",
    "KibleSaati": "10:42",
    "Ogle": "13:16",
    "Yatsi": "19:26"
  },
  {
    "HicriTarihKisa": "8.7.1447",
    "HicriTarihKisaIso8601": null,
    "HicriTarihUzun": "8 Recep 1447",
    "HicriTarihUzunIso8601": null,
    "AyinSekliURL": "https://namazvakti.diyanet.gov.tr/images/i1.gif",
    "MiladiTarihKisa": "28.12.2025",
    "MiladiTarihKisaIso8601": "28.12.2025",
    "MiladiTarihUzun": "28 Aralık 2025 Pazar",
    "MiladiTarihUzunIso8601": "2025-12-28T00:00:00.0000000+03:00",
    "GreenwichOrtalamaZamani": 3.0,
    "Aksam": "18:05",
    "Gunes": "08:17",
    "GunesBatis": "17:58",
    "GunesDogus": "08:24",
    "Ikindi": "15:44",
    "Imsak": "06:50",
    "KibleSaati": "10:42",
    "Ogle": "13:16",
    "Yatsi": "19:27"
  },
  {
    "HicriTarihKisa": "9.7.1447",
    "HicriTarihKisaIso8601": null,
    "HicriTarihUzun": "9 Recep 1447",
    "HicriTarihUzunIso8601": null,
    "AyinSekliURL": "https://namazvakti.diyanet.gov.tr/images/i2.gif",
    "MiladiTarihKisa": "29.12.2025",
    "MiladiTarihKisaIso8601": "29.12.2025",
    "MiladiTarihUzun": "29 Aralık 2025 Pazartesi",
    "MiladiTarihUzunIso8601": "2025-12-29T00:00:00.0000000+03:00",
    "GreenwichOrtalamaZamani": 3.0,
    "Aksam": "18:05",
    "Gunes": "08:18",
    "GunesBatis": "17:58",
    "GunesDogus": "08:25",
    "Ikindi": "15:45",
    "Imsak": "06:50",
    "KibleSaati": "10:43",
    "Ogle": "13:17",
    "Yatsi": "19:27"
  },
  {
    "HicriTarihKisa": "10.7.1447",
    "HicriTarihKisaIso8601": null,
    "HicriTarihUzun": "10 Recep 1447",
    "HicriTarihUzunIso8601": null,
    "AyinSekliURL": "https://namazvakti.diyanet.gov.tr/images/i3.gif",
    "MiladiTarihKisa": "30.12.2025",
    "MiladiTarihKisaIso8601": "30.12.2025",
    "MiladiTarihUzun": "30 Aralık 2025 Salı",
    "MiladiTarihUzunIso8601": "2025-12-30T00:00:00.0000000+03:00",
    "GreenwichOrtalamaZamani": 3.0,
    "Aksam": "18:06",
    "Gunes": "08:18",
    "GunesBatis": "17:59",
    "GunesDogus": "08:25",
    "Ikindi": "15:45",
    "Imsak": "06:51",
    "KibleSaati": "10:43",
    "Ogle": "13:17",
    "Yatsi": "19:28"
  },
  {
    "HicriTarihKisa": "11.7.1447",
    "HicriTarihKisaIso8601": null,
    "HicriTarihUzun": "11 Recep 1447",
    "HicriTarihUzunIso8601": null,
    "AyinSekliURL": "https://namazvakti.diyanet.gov.tr/images/i4.gif",
    "MiladiTarihKisa": "31.12.2025",
    "MiladiTarihKisaIso8601": "31.12.2025",
    "MiladiTarihUzun": "31 Aralık 2025 Çarşamba",
    "MiladiTarihUzunIso8601": "2025-12-31T00:00:00.0000000+03:00",
    "GreenwichOrtalamaZamani": 3.0,
    "Aksam": "18:07",
    "Gunes": "08:18",
    "GunesBatis": "18:00",
    "GunesDogus": "08:25",
    "Ikindi": "15:46",
    "Imsak": "06:51",
    "KibleSaati": "10:44",
    "Ogle": "13:17",
    "Yatsi": "19:29"
  },
  {
    "HicriTarihKisa": "12.7.1447",
    "HicriTarihKisaIso8601": null,
    "HicriTarihUzun": "12 Recep 1447",
    "HicriTarihUzunIso8601": null,
    "AyinSekliURL": "https://namazvakti.diyanet.gov.tr/images/i6.gif",
    "MiladiTarihKisa": "01.01.2026",
    "MiladiTarihKisaIso8601": "01.01.2026",
    "MiladiTarihUzun": "01 Ocak 2026 Perşembe",
    "MiladiTarihUzunIso8601": "2026-01-01T00:00:00.0000000+03:00",
    "GreenwichOrtalamaZamani": 3.0,
    "Aksam": "18:08",
    "Gunes": "08:18",
    "GunesBatis": "18:01",
    "GunesDogus": "08:25",
    "Ikindi": "15:47",
    "Imsak": "06:51",
    "KibleSaati": "10:45",
    "Ogle": "13:18",
    "Yatsi": "19:30"
  },
  {
    "HicriTarihKisa": "13.7.1447",
    "HicriTarihKisaIso8601": null,
    "HicriTarihUzun": "13 Recep 1447",
    "HicriTarihUzunIso8601": null,
    "AyinSekliURL": "https://namazvakti.diyanet.gov.tr/images/i7.gif",
    "MiladiTarihKisa": "02.01.2026",
    "MiladiTarihKisaIso8601": "02.01.2026",
    "MiladiTarihUzun": "02 Ocak 2026 Cuma",
    "MiladiTarihUzunIso8601": "2026-01-02T00:00:00.0000000+03:00",
    "GreenwichOrtalamaZamani": 3.0,
    "Aksam": "18:08",
    "Gunes": "08:18",
    "GunesBatis": "18:01",
    "GunesDogus": "08:25",
    "Ikindi": "15:48",
    "Imsak": "06:51",
    "KibleSaati": "10:45",
    "Ogle": "13:18",
    "Yatsi": "19:30"
  },
  {
    "HicriTarihKisa": "14.7.1447",
    "HicriTarihKisaIso8601": null,
    "HicriTarihUzun": "14 Recep 1447",
    "HicriTarihUzunIso8601": null,
    "AyinSekliURL": "https://namazvakti.diyanet.gov.tr/images/dolunay.gif",
    "MiladiTarihKisa": "03.01.2026",
    "MiladiTarihKisaIso8601": "03.01.2026",
    "MiladiTarihUzun": "03 Ocak 2026 Cumartesi",
    "MiladiTarihUzunIso8601": "2026-01-03T00:00:00.0000000+03:00",
    "GreenwichOrtalamaZamani": 3.0,
    "Aksam": "18:09",
    "Gunes": "08:19",
    "GunesBatis": "18:02",
    "GunesDogus": "08:26",
    "Ikindi": "15:48",
    "Imsak": "06:52",
    "KibleSaati": "10:46",
    "Ogle": "13:19",
    "Yatsi": "19:31"
  },
  {
    "HicriTarihKisa": "15.7.1447",
    "HicriTarihKisaIso8601": null,
    "HicriTarihUzun": "15 Recep 1447",
    "HicriTarihUzunIso8601": null,
    "AyinSekliURL": "https://namazvakti.diyanet.gov.tr/images/d1.gif",
    "MiladiTarihKisa": "04.01.2026",
    "MiladiTarihKisaIso8601": "04.01.2026",
    "MiladiTarihUzun": "04 Ocak 2026 Pazar",
    "MiladiTarihUzunIso8601": "2026-01-04T00:00:00.0000000+03:00",
    "GreenwichOrtalamaZamani": 3.0,
    "Aksam": "18:10",
    "Gunes": "08:19",
    "GunesBatis": "18:03",
    "GunesDogus": "08:26",
    "Ikindi": "15:49",
    "Imsak": "06:52",
    "KibleSaati": "10:47",
    "Ogle": "13:19",
    "Yatsi": "19:32"
  },
  {
    "HicriTarihKisa": "16.7.1447",
    "HicriTarihKisaIso8601": null,
    "HicriTarihUzun": "16 Recep 1447",
    "HicriTarihUzunIso8601": null,
    "AyinSekliURL": "https://namazvakti.diyanet.gov.tr/images/d2.gif",
    "MiladiTarihKisa": "05.01.2026",
    "MiladiTarihKisaIso8601": "05.01.2026",
    "MiladiTarihUzun": "05 Ocak 2026 Pazartesi",
    "MiladiTarihUzunIso8601": "2026-01-05T00:00:00.0000000+03:00",
    "GreenwichOrtalamaZamani": 3.0,
    "Aksam": "18:11",
    "Gunes": "08:19",
    "GunesBatis": "18:04",
    "GunesDogus": "08:26",
    "Ikindi": "15:50",
    "Imsak": "06:52",
    "KibleSaati": "10:48",
    "Ogle": "13:20",
    "Yatsi": "19:33"
  },
  {
    "HicriTarihKisa": "17.7.1447",
    "HicriTarihKisaIso8601": null,
    "HicriTarihUzun": "17 Recep 1447",
    "HicriTarihUzunIso8601": null,
    "AyinSekliURL": "https://namazvakti.diyanet.gov.tr/images/d3.gif",
    "MiladiTarihKisa": "06.01.2026",
    "MiladiTarihKisaIso8601": "06.01.2026",
    "MiladiTarihUzun": "06 Ocak 2026 Salı",
    "MiladiTarihUzunIso8601": "2026-01-06T00:00:00.0000000+03:00",
    "GreenwichOrtalamaZamani": 3.0,
    "Aksam": "18:12",
    "Gunes": "08:19",
    "GunesBatis": "18:05",
    "GunesDogus": "08:26",
    "Ikindi": "15:51",
    "Imsak": "06:52",
    "KibleSaati": "10:48",
    "Ogle": "13:20",
    "Yatsi": "19:33"
  },
  {
    "HicriTarihKisa": "18.7.1447",
    "HicriTarihKisaIso8601": null,
    "HicriTarihUzun": "18 Recep 1447",
    "HicriTarihUzunIso8601": null,
    "AyinSekliURL": "https://namazvakti.diyanet.gov.tr/images/d4.gif",
    "MiladiTarihKisa": "07.01.2026",
    "MiladiTarihKisaIso8601": "07.01.2026",
    "MiladiTarihUzun": "07 Ocak 2026 Çarşamba",
    "MiladiTarihUzunIso8601": "2026-01-07T00:00:00.0000000+03:00",
    "GreenwichOrtalamaZamani": 3.0,
    "Aksam": "18:13",
    "Gunes": "08:19",
    "GunesBatis": "18:06",
    "GunesDogus": "08:26",
    "Ikindi": "15:52",
    "Imsak": "06:52",
    "KibleSaati": "10:49",
    "Ogle": "13:21",
    "Yatsi": "19:34"
  },
  {
    "HicriTarihKisa": "19.7.1447",
    "HicriTarihKisaIso8601": null,
    "HicriTarihUzun": "19 Recep 1447",
    "HicriTarihUzunIso8601": null,
    "AyinSekliURL": "https://namazvakti.diyanet.gov.tr/images/d5.gif",
    "MiladiTarihKisa": "08.01.2026",
    "MiladiTarihKisaIso8601": "08.01.2026",
    "MiladiTarihUzun": "08 Ocak 2026 Perşembe",
    "MiladiTarihUzunIso8601": "2026-01-08T00:00:00.0000000+03:00",
    "GreenwichOrtalamaZamani": 3.0,
    "Aksam": "18:14",
    "Gunes": "08:19",
    "GunesBatis": "18:07",
    "GunesDogus": "08:26",
    "Ikindi": "15:52",
    "Imsak": "06:52",
    "KibleSaati": "10:50",
    "Ogle": "13:21",
    "Yatsi": "19:35"
  },
  {
    "HicriTarihKisa": "20.7.1447",
    "HicriTarihKisaIso8601": null,
    "HicriTarihUzun": "20 Recep 1447",
    "HicriTarihUzunIso8601": null,
    "AyinSekliURL": "https://namazvakti.diyanet.gov.tr/images/d6.gif",
    "MiladiTarihKisa": "09.01.2026",
    "MiladiTarihKisaIso8601": "09.01.2026",
    "MiladiTarihUzun": "09 Ocak 2026 Cuma",
    "MiladiTarihUzunIso8601": "2026-01-09T00:00:00.0000000+03:00",
    "GreenwichOrtalamaZamani": 3.0,
    "Aksam": "18:15",
    "Gunes": "08:19",
    "GunesBatis": "18:08",
    "GunesDogus": "08:26",
    "Ikindi": "15:53",
    "Imsak": "06:52",
    "KibleSaati": "10:51",
    "Ogle": "13:22",
    "Yatsi": "19:36"
  },
  {
    "HicriTarihKisa": "21.7.1447",
    "HicriTarihKisaIso8601": null,
    "HicriTarihUzun": "21 Recep 1447",
    "HicriTarihUzunIso8601": null,
    "AyinSekliURL": "https://namazvakti.diyanet.gov.tr/images/sondordun.gif",
    "MiladiTarihKisa": "10.01.2026",
    "MiladiTarihKisaIso8601": "10.01.2026",
    "MiladiTarihUzun": "10 Ocak 2026 Cumartesi",
    "MiladiTarihUzunIso8601": "2026-01-10T00:00:00.0000000+03:00",
    "GreenwichOrtalamaZamani": 3.0,
    "Aksam": "18:16",
    "Gunes": "08:18",
    "GunesBatis": "18:09",
    "GunesDogus": "08:25",
    "Ikindi": "15:54",
    "Imsak": "06:52",
    "KibleSaati": "10:51",
    "Ogle": "13:22",
    "Yatsi": "19:37"
  },
  {
    "HicriTarihKisa": "22.7.1447",
    "HicriTarihKisaIso8601": null,
    "HicriTarihUzun": "22 Recep 1447",
    "HicriTarihUzunIso8601": null,
    "AyinSekliURL": "https://namazvakti.diyanet.gov.tr/images/sd1.gif",
    "MiladiTarihKisa": "11.01.2026",
    "MiladiTarihKisaIso8601": "11.01.2026",
    "MiladiTarihUzun": "11 Ocak 2026 Pazar",
    "MiladiTarihUzunIso8601": "2026-01-11T00:00:00.0000000+03:00",
    "GreenwichOrtalamaZamani": 3.0,
    "Aksam": "18:17",
    "Gunes": "08:18",
    "GunesBatis": "18:10",
    "GunesDogus": "08:25",
    "Ikindi": "15:55",
    "Imsak": "06:52",
    "KibleSaati": "10:52",
    "Ogle": "13:22",
    "Yatsi": "19:37"
  },
  {
    "HicriTarihKisa": "23.7.1447",
    "HicriTarihKisaIso8601": null,
    "HicriTarihUzun": "23 Recep 1447",
    "HicriTarihUzunIso8601": null,
    "AyinSekliURL": "https://namazvakti.diyanet.gov.tr/images/sd2.gif",
    "MiladiTarihKisa": "12.01.2026",
    "MiladiTarihKisaIso8601": "12.01.2026",
    "MiladiTarihUzun": "12 Ocak 2026 Pazartesi",
    "MiladiTarihUzunIso8601": "2026-01-12T00:00:00.0000000+03:00",
    "GreenwichOrtalamaZamani": 3.0,
    "Aksam": "18:18",
    "Gunes": "08:18",
    "GunesBatis": "18:11",
    "GunesDogus": "08:25",
    "Ikindi": "15:56",
    "Imsak": "06:52",
    "KibleSaati": "10:53",
    "Ogle": "13:23",
    "Yatsi": "19:38"
  },
  {
    "HicriTarihKisa": "24.7.1447",
    "HicriTarihKisaIso8601": null,
    "HicriTarihUzun": "24 Recep 1447",
    "HicriTarihUzunIso8601": null,
    "AyinSekliURL": "https://namazvakti.diyanet.gov.tr/images/sd3.gif",
    "MiladiTarihKisa": "13.01.2026",
    "MiladiTarihKisaIso8601": "13.01.2026",
    "MiladiTarihUzun": "13 Ocak 2026 Salı",
    "MiladiTarihUzunIso8601": "2026-01-13T00:00:00.0000000+03:00",
    "GreenwichOrtalamaZamani": 3.0,
    "Aksam": "18:19",
    "Gunes": "08:18",
    "GunesBatis": "18:12",
    "GunesDogus": "08:25",
    "Ikindi": "15:57",
    "Imsak": "06:52",
    "KibleSaati": "10:54",
    "Ogle": "13:23",
    "Yatsi": "19:39"
  },
  {
    "HicriTarihKisa": "25.7.1447",
    "HicriTarihKisaIso8601": null,
    "HicriTarihUzun": "25 Recep 1447",
    "HicriTarihUzunIso8601": null,
    "AyinSekliURL": "https://namazvakti.diyanet.gov.tr/images/sd4.gif",
    "MiladiTarihKisa": "14.01.2026",
    "MiladiTarihKisaIso8601": "14.01.2026",
    "MiladiTarihUzun": "14 Ocak 2026 Çarşamba",
    "MiladiTarihUzunIso8601": "2026-01-14T00:00:00.0000000+03:00",
    "GreenwichOrtalamaZamani": 3.0,
    "Aksam": "18:20",
    "Gunes": "08:18",
    "GunesBatis": "18:13",
    "GunesDogus": "08:25",
    "Ikindi": "15:58",
    "Imsak": "06:52",
    "KibleSaati": "10:55",
    "Ogle": "13:24",
    "Yatsi": "19:40"
  },
  {
    "HicriTarihKisa": "26.7.1447",
    "HicriTarihKisaIso8601": null,
    "HicriTarihUzun": "26 Recep 1447",
    "HicriTarihUzunIso8601": null,
    "AyinSekliURL": "https://namazvakti.diyanet.gov.tr/images/sd5.gif",
    "MiladiTarihKisa": "15.01.2026",
    "MiladiTarihKisaIso8601": "15.01.2026",
    "MiladiTarihUzun": "15 Ocak 2026 Perşembe",
    "MiladiTarihUzunIso8601": "2026-01-15T00:00:00.0000000+03:00",
    "GreenwichOrtalamaZamani": 3.0,
    "Aksam": "18:21",
    "Gunes": "08:17",
    "GunesBatis": "18:14",
    "GunesDogus": "08:24",
    "Ikindi": "15:59",
    "Imsak": "06:52",
    "KibleSaati": "10:55",
    "Ogle": "13:24",
    "Yatsi": "19:41"
  },
  {
    "HicriTarihKisa": "27.7.1447",
    "HicriTarihKisaIso8601": null,
    "HicriTarihUzun": "27 Recep 1447",
    "HicriTarihUzunIso8601": null,
    "AyinSekliURL": "https://namazvakti.diyanet.gov.tr/images/sd6.gif",
    "MiladiTarihKisa": "16.01.2026",
    "MiladiTarihKisaIso8601": "16.01.2026",
    "MiladiTarihUzun": "16 Ocak 2026 Cuma",
    "MiladiTarihUzunIso8601": "2026-01-16T00:00:00.0000000+03:00",
    "GreenwichOrtalamaZamani": 3.0,
    "Aksam": "18:22",
    "Gunes": "08:17",
    "GunesBatis": "18:15",
    "GunesDogus": "08:24",
    "Ikindi": "16:00",
    "Imsak": "06:51",
    "KibleSaati": "10:56",
    "Ogle": "13:24",
    "Yatsi": "19:42"
  },
  {
    "HicriTarihKisa": "28.7.1447",
    "HicriTarihKisaIso8601": null,
    "HicriTarihUzun": "28 Recep 1447",
    "HicriTarihUzunIso8601": null,
    "AyinSekliURL": "https://namazvakti.diyanet.gov.tr/images/sd7.gif",
    "MiladiTarihKisa": "17.01.2026",
    "MiladiTarihKisaIso8601": "17.01.2026",
    "MiladiTarihUzun": "17 Ocak 2026 Cumartesi",
    "MiladiTarihUzunIso8601": "2026-01-17T00:00:00.0000000+03:00",
    "GreenwichOrtalamaZamani": 3.0,
    "Aksam": "18:23",
    "Gunes": "08:17",
    "GunesBatis": "18:16",
    "GunesDogus": "08:24",
    "Ikindi": "16:00",
    "Imsak": "06:51",
    "KibleSaati": "10:57",
    "Ogle": "13:25",
    "Yatsi": "19:43"
  },
  {
    "HicriTarihKisa": "29.7.1447",
    "HicriTarihKisaIso8601": null,
    "HicriTarihUzun": "29 Recep 1447",
    "HicriTarihUzunIso8601": null,
    "AyinSekliURL": "https://namazvakti.diyanet.gov.tr/images/ictima.gif",
    "MiladiTarihKisa": "18.01.2026",
    "MiladiTarihKisaIso8601": "18.01.2026",
    "MiladiTarihUzun": "18 Ocak 2026 Pazar",
    "MiladiTarihUzunIso8601": "2026-01-18T00:00:00.0000000+03:00",
    "GreenwichOrtalamaZamani": 3.0,
    "Aksam": "18:24",
    "Gunes": "08:16",
    "GunesBatis": "18:17",
    "GunesDogus": "08:23",
    "Ikindi": "16:01",
    "Imsak": "06:51",
    "KibleSaati": "10:58",
    "Ogle": "13:25",
    "Yatsi": "19:44"
  },
  {
    "HicriTarihKisa": "30.7.1447",
    "HicriTarihKisaIso8601": null,
    "HicriTarihUzun": "30 Recep 1447",
    "HicriTarihUzunIso8601": null,
    "AyinSekliURL": "https://namazvakti.diyanet.gov.tr/images/ruyet.gif",
    "MiladiTarihKisa": "19.01.2026",
    "MiladiTarihKisaIso8601": "19.01.2026",
    "MiladiTarihUzun": "19 Ocak 2026 Pazartesi",
    "MiladiTarihUzunIso8601": "2026-01-19T00:00:00.0000000+03:00",
    "GreenwichOrtalamaZamani": 3.0,
    "Aksam": "18:25",
    "Gunes": "08:16",
    "GunesBatis": "18:18",
    "GunesDogus": "08:23",
    "Ikindi": "16:02",
    "Imsak": "06:51",
    "KibleSaati": "10:59",
    "Ogle": "13:25",
    "Yatsi": "19:45"
  }
]