[
  {
    "HicriTarihKisa": "5.7.1447",
    "HicriTarihKisaIso8601": null,
    "HicriTarihUzun": "5 Recep 1447",
    "HicriTarihUzunIso8601": null,
    "AyinSekliURL": "https://namazvakti.diyanet.gov.tr/images/r5.gif",
    "MiladiTarihKisa": "25.12.2025",
    "MiladiTarihKisaIso8601": "25.12.2025",
    "MiladiTarihUzun": "25 Aralık 2025 Perşembe",
    "MiladiTarihUzunIso8601": "2025-12-25T00:00:00.0000000+08:00",
    "GreenwichOrtalamaZamani": 3.0,
    "Aksam": "17:23",
    "Gunes": "07:10",
    "GunesBatis": "17:16",
    "GunesDogus": "07:17",
    "Ikindi": "15:02",
    "Imsak": "05:49",
    "KibleSaati": "00:00",
    "Ogle": "12:22",
    "Yatsi": "18:35"
  },
  {
    "HicriTarihKisa": "6.7.1447",
    "HicriTarihKisaIso8601": null,
    "HicriTarihUzun": "6 Recep 1447",
    "HicriTarihUzunIso8601": null,
    "AyinSekliURL": "https://namazvakti.diyanet.gov.tr/images/r6.gif",
    "MiladiTarihKisa": "26.12.2025",
    "MiladiTarihKisaIso8601": "26.12.2025",
    "MiladiTarihUzun": "26 Aralık 2025 Cuma",
    "MiladiTarihUzunIso8601": "2025-12-26T00:00:00.0000000+08:00",
    "GreenwichOrtalamaZamani": 3.0,
    "Aksam": "17:24",
    "Gunes": "07:11",
    "GunesBatis": "17:17",
    "GunesDogus": "07:18",
    "Ikindi": "15:03",
    "Imsak": "05:49",
    "KibleSaati": "00:00",
    "Ogle": "12:22",
    "Yatsi": "18:35"
  },
  {
    "HicriTarihKisa": "7.7.1447",
    "HicriTarihKisaIso8601": null,
    "HicriTarihUzun": "7 Recep 1447",
    "HicriTarihUzunIso8601": null,
    "AyinSekliURL": "https://namazvakti.diyanet.gov.tr/images/ilkdordun.gif",
    "MiladiTarihKisa": "27.12.2025",
    "MiladiTarihKisaIso8601": "27.12.2025",
    "MiladiTarihUzun": "27 Aralık 2025 Cumartesi",
    "MiladiTarihUzunIso8601": "2025-12-27T00:00:00.0000000+08:00",
    "GreenwichOrtalamaZamani": 3.0,
    "Aksam": "17:24",
    "Gunes": "07:11",
    "GunesBatis": "17:17",
    "GunesDogus": "07:18",
    "Ikindi": "15:03",
    "Imsak": "05:50",
    "KibleSaati": "00:00",
    "Ogle": "12:23",
    "Yatsi": "18:36"
  },
  {
    "HicriTarihKisa": "8.7.1447",
    "HicriTarihKisaIso8601": null,
    "HicriTarihUzun": "8 Recep 1447",
    "HicriTarihUzunIso8601": null,
    "AyinSekliURL": "https://namazvakti.diyanet.gov.tr/images/i1.gif",
    "MiladiTarihKisa": "28.12.2025",
    "MiladiTarihKisaIso8601": "28.12.2025",
    "MiladiTarihUzun": "28 Aralık 2025 Pazar",
    "MiladiTarihUzunIso8601": "2025-12-28T00:00:00.0000000+08:00",
    "GreenwichOrtalamaZamani": 3.0,
    "Aksam": "17:25",
    "Gunes": "07:11",
    "GunesBatis": "17:18",
    "GunesDogus": "07:18",
    "Ikindi": "15:04",
    "Imsak": "05:50",
    "KibleSaati": "00:00",
    "Ogle": "12:23",
    "Yatsi": "18:36"
  },
  {
    "HicriTarihKisa": "9.7.1447",
    "HicriTarihKisaIso8601": null,
    "HicriTarihUzun": "9 Recep 1447",
    "HicriTarihUzunIso8601": null,
    "AyinSekliURL": "https://namazvakti.diyanet.gov.tr/images/i2.gif",
    "MiladiTarihKisa": "29.12.2025",
    "MiladiTarihKisaIso8601": "29.12.2025",
    "MiladiTarihUzun": "29 Aralık 2025 Pazartesi",
    "MiladiTarihUzunIso8601": "2025-12-29T00:00:00.0000000+08:00",
    "GreenwichOrtalamaZamani": 3.0,
    "Aksam": "17:26",
    "Gunes": "07:12",
    "GunesBatis": "17:19",
    "GunesDogus": "07:19",
    "Ikindi": "15:05",
    "Imsak": "05:50",
    "KibleSaati": "00:00",
    "Ogle": "12:24",
    "Yatsi": "18:37"
  },
  {
    "HicriTarihKisa": "10.7.1447",
    "HicriTarihKisaIso8601": null,
    "HicriTarihUzun": "10 Recep 1447",
    "HicriTarihUzunIso8601": null,
    "AyinSekliURL": "https://namazvakti.diyanet.gov.tr/images/i3.gif",
    "MiladiTarihKisa": "30.12.2025",
    "MiladiTarihKisaIso8601": "30.12.2025",
    "MiladiTarihUzun": "30 Aralık 2025 Salı",
    "MiladiTarihUzunIso8601": "2025-12-30T00:00:00.0000000+08:00",
    "GreenwichOrtalamaZamani": 3.0,
    "Aksam": "17:26",
    "Gunes": "07:12",
    "GunesBatis": "17:19",
    "GunesDogus": "07:19",
    "Ikindi": "15:05",
    "Imsak": "05:51",
    "KibleSaati": "00:00",
    "Ogle": "12:24",
    "Yatsi": "18:38"
  },
  {
    "HicriTarihKisa": "11.7.1447",
    "HicriTarihKisaIso8601": null,
    "HicriTarihUzun": "11 Recep 1447",
    "HicriTarihUzunIso8601": null,
    "AyinSekliURL": "https://namazvakti.diyanet.gov.tr/images/i4.gif",
    "MiladiTarihKisa": "31.12.2025",
    "MiladiTarihKisaIso8601": "31.12.2025",
    "MiladiTarihUzun": "31 Aralık 2025 Çarşamba",
    "MiladiTarihUzunIso8601": "2025-12-31T00:00:00.0000000+08:00",
    "GreenwichOrtalamaZamani": 3.0,
    "Aksam": "17:27",
    "Gunes": "07:12",
    "GunesBatis": "17:20",
    "GunesDogus": "07:19",
    "Ikindi": "15:06",
    "Imsak": "05:51",
    "KibleSaati": "00:00",
    "Ogle": "12:25",
    "Yatsi": "18:38"
  },
  {
    "HicriTarihKisa": "12.7.1447",
    "HicriTarihKisaIso8601": null,
    "HicriTarihUzun": "12 Recep 1447",
    "HicriTarihUzunIso8601": null,
    "AyinSekliURL": "https://namazvakti.diyanet.gov.tr/images/i6.gif",
    "MiladiTarihKisa": "01.01.2026",
    "MiladiTarihKisaIso8601": "01.01.2026",
    "MiladiTarihUzun": "01 Ocak 2026 Perşembe",
    "MiladiTarihUzunIso8601": "2026-01-01T00:00:00.0000000+08:00",
    "GreenwichOrtalamaZamani": 3.0,
    "Aksam": "17:28",
    "Gunes": "07:12",
    "GunesBatis": "17:21",
    "GunesDogus": "07:19",
    "Ikindi": "15:07",
    "Imsak": "05:51",
    "KibleSaati": "00:00",
    "Ogle": "12:25",
    "Yatsi": "18:39"
  },
  {
    "HicriTarihKisa": "13.7.1447",
    "HicriTarihKisaIso8601": null,
    "HicriTarihUzun": "13 Recep 1447",
    "HicriTarihUzunIso8601": null,
    "AyinSekliURL": "https://namazvakti.diyanet.gov.tr/images/i7.gif",
    "MiladiTarihKisa": "02.01.2026",
    "MiladiTarihKisaIso8601": "02.01.2026",
    "MiladiTarihUzun": "02 Ocak 2026 Cuma",
    "MiladiTarihUzunIso8601": "2026-01-02T00:00:00.0000000+08:00",
    "GreenwichOrtalamaZamani": 3.0,
    "Aksam": "17:28",
    "Gunes": "07:13",
    "GunesBatis": "17:21",
    "GunesDogus": "07:20",
    "Ikindi": "15:07",
    "Imsak": "05:52",
    "KibleSaati": "00:00",
    "Ogle": "12:26",
    "Yatsi": "18:40"
  },
  {
    "HicriTarihKisa": "14.7.1447",
    "HicriTarihKisaIso8601": null,
    "HicriTarihUzun": "14 Recep 1447",
    "HicriTarihUzunIso8601": null,
    "AyinSekliURL": "https://namazvakti.diyanet.gov.tr/images/dolunay.gif",
    "MiladiTarihKisa": "03.01.2026",
    "MiladiTarihKisaIso8601": "03.01.2026",
    "MiladiTarihUzun": "03 Ocak 2026 Cumartesi",
    "MiladiTarihUzunIso8601": "2026-01-03T00:00:00.0000000+08:00",
    "GreenwichOrtalamaZamani": 3.0,
    "Aksam": "17:29",
    "Gunes": "07:13",
    "GunesBatis": "17:22",
    "GunesDogus": "07:20",
    "Ikindi": "15:08",
    "Imsak": "05:52",
    "KibleSaati": "00:00",
    "Ogle": "12:26",
    "Yatsi": "18:40"
  },
  {
    "HicriTarihKisa": "15.7.1447",
    "HicriTarihKisaIso8601": null,
    "HicriTarihUzun": "15 Recep 1447",
    "HicriTarihUzunIso8601": null,
    "AyinSekliURL": "https://namazvakti.diyanet.gov.tr/images/d1.gif",
    "MiladiTarihKisa": "04.01.2026",
    "MiladiTarihKisaIso8601": "04.01.2026",
    "MiladiTarihUzun": "04 Ocak 2026 Pazar",
    "MiladiTarihUzunIso8601": "2026-01-04T00:00:00.0000000+08:00",
    "GreenwichOrtalamaZamani": 3.0,
    "Aksam": "17:30",
    "Gunes": "07:13",
    "GunesBatis": "17:23",
    "GunesDogus": "07:20",
    "Ikindi": "15:09",
    "Imsak": "05:52",
    "KibleSaati": "00:00",
    "Ogle": "12:26",
    "Yatsi": "18:41"
  },
  {
    "HicriTarihKisa": "16.7.1447",
    "HicriTarihKisaIso8601": null,
    "HicriTarihUzun": "16 Recep 1447",
    "HicriTarihUzunIso8601": null,
    "AyinSekliURL": "https://namazvakti.diyanet.gov.tr/images/d2.gif",
    "MiladiTarihKisa": "05.01.2026",
    "MiladiTarihKisaIso8601": "05.01.2026",
    "MiladiTarihUzun": "05 Ocak 2026 Pazartesi",
    "MiladiTarihUzunIso8601": "2026-01-05T00:00:00.0000000+08:00",
    "GreenwichOrtalamaZamani": 3.0,
    "Aksam": "17:31",
    "Gunes": "07:13",
    "GunesBatis": "17:24",
    "GunesDogus": "07:20",
    "Ikindi": "15:09",
    "Imsak": "05:52",
    "KibleSaati": "00:00",
    "Ogle": "12:27",
    "Yatsi": "18:42"
  },
  {
    "HicriTarihKisa": "17.7.1447",
    "HicriTarihKisaIso8601": null,
    "HicriTarihUzun": "17 Recep 1447",
    "HicriTarihUzunIso8601": null,
    "AyinSekliURL": "https://namazvakti.diyanet.gov.tr/images/d3.gif",
    "MiladiTarihKisa": "06.01.2026",
    "MiladiTarihKisaIso8601": "06.01.2026",
    "MiladiTarihUzun": "06 Ocak 2026 Salı",
    "MiladiTarihUzunIso8601": "2026-01-06T00:00:00.0000000+08:00",
    "GreenwichOrtalamaZamani": 3.0,
    "Aksam": "17:32",
    "Gunes": "07:13",
    "GunesBatis": "17:25",
    "GunesDogus": "07:20",
    "Ikindi": "15:10",
    "Imsak": "05:52",
    "KibleSaati": "00:00",
    "Ogle": "12:27",
    "Yatsi": "18:42"
  },
  {
    "HicriTarihKisa": "18.7.1447",
    "HicriTarihKisaIso8601": null,
    "HicriTarihUzun": "18 Recep 1447",
    "HicriTarihUzunIso8601": null,
    "AyinSekliURL": "https://namazvakti.diyanet.gov.tr/images/d4.gif",
    "MiladiTarihKisa": "07.01.2026",
    "MiladiTarihKisaIso8601": "07.01.2026",
    "MiladiTarihUzun": "07 Ocak 2026 Çarşamba",
    "MiladiTarihUzunIso8601": "2026-01-07T00:00:00.0000000+08:00",
    "GreenwichOrtalamaZamani": 3.0,
    "Aksam": "17:32",
    "Gunes": "07:13",
    "GunesBatis": "17:25",
    "GunesDogus": "07:20",
    "Ikindi": "15:11",
    "Imsak": "05:53",
    "KibleSaati": "00:00",
    "Ogle": "12:28",
    "Yatsi": "18:43"
  },
  {
    "HicriTarihKisa": "19.7.1447",
    "HicriTarihKisaIso8601": null,
    "HicriTarihUzun": "19 Recep 1447",
    "HicriTarihUzunIso8601": null,
    "AyinSekliURL": "https://namazvakti.diyanet.gov.tr/images/d5.gif",
    "MiladiTarihKisa": "08.01.2026",
    "MiladiTarihKisaIso8601": "08.01.2026",
    "MiladiTarihUzun": "08 Ocak 2026 Perşembe",
    "MiladiTarihUzunIso8601": "2026-01-08T00:00:00.0000000+08:00",
    "GreenwichOrtalamaZamani": 3.0,
    "Aksam": "17:33",
    "Gunes": "07:13",
    "GunesBatis": "17:26",
    "GunesDogus": "07:20",
    "Ikindi": "15:12",
    "Imsak": "05:53",
    "KibleSaati": "00:00",
    "Ogle": "12:28",
    "Yatsi": "18:44"
  },
  {
    "HicriTarihKisa": "20.7.1447",
    "HicriTarihKisaIso8601": null,
    "HicriTarihUzun": "20 Recep 1447",
    "HicriTarihUzunIso8601": null,
    "AyinSekliURL": "https://namazvakti.diyanet.gov.tr/images/d6.gif",
    "MiladiTarihKisa": "09.01.2026",
    "MiladiTarihKisaIso8601": "09.01.2026",
    "MiladiTarihUzun": "09 Ocak 2026 Cuma",
    "MiladiTarihUzunIso8601": "2026-01-09T00:00:00.0000000+08:00",
    "GreenwichOrtalamaZamani": 3.0,
    "Aksam": "17:34",
    "Gunes": "07:13",
    "GunesBatis": "17:27",
    "GunesDogus": "07:20",
    "Ikindi": "15:12",
    "Imsak": "05:53",
    "KibleSaati": "00:00",
    "Ogle": "12:29",
    "Yatsi": "18:45"
  },
  {
    "HicriTarihKisa": "21.7.1447",
    "HicriTarihKisaIso8601": null,
    "HicriTarihUzun": "21 Recep 1447",
    "HicriTarihUzunIso8601": null,
    "AyinSekliURL": "https://namazvakti.diyanet.gov.tr/images/sondordun.gif",
    "MiladiTarihKisa": "10.01.2026",
    "MiladiTarihKisaIso8601": "10.01.2026",
    "MiladiTarihUzun": "10 Ocak 2026 Cumartesi",
    "MiladiTarihUzunIso8601": "2026-01-10T00:00:00.0000000+08:00",
    "GreenwichOrtalamaZamani": 3.0,
    "Aksam": "17:35",
    "Gunes": "07:13",
    "GunesBatis": "17:28",
    "GunesDogus": "07:20",
    "Ikindi": "15:13",
    "Imsak": "05:53",
    "KibleSaati": "00:00",
    "Ogle": "12:29",
    "Yatsi": "18:45"
  },
  {
    "HicriTarihKisa": "22.7.1447",
    "HicriTarihKisaIso8601": null,
    "HicriTarihUzun": "22 Recep 1447",
    "HicriTarihUzunIso8601": null,
    "AyinSekliURL": "https://namazvakti.diyanet.gov.tr/images/sd1.gif",
    "MiladiTarihKisa": "11.01.2026",
    "MiladiTarihKisaIso8601": "11.01.2026",
    "MiladiTarihUzun": "11 Ocak 2026 Pazar",
    "MiladiTarihUzunIso8601": "2026-01-11T00:00:00.0000000+08:00",
    "GreenwichOrtalamaZamani": 3.0,
    "Aksam": "17:36",
    "Gunes": "07:13",
    "GunesBatis": "17:29",
    "GunesDogus": "07:20",
    "Ikindi": "15:14",
    "Imsak": "05:53",
    "KibleSaati": "00:00",
    "Ogle": "12:29",
    "Yatsi": "18:46"
  },
  {
    "HicriTarihKisa": "23.7.1447",
    "HicriTarihKisaIso8601": null,
    "HicriTarihUzun": "23 Recep 1447",
    "HicriTarihUzunIso8601": null,
    "AyinSekliURL": "https://namazvakti.diyanet.gov.tr/images/sd2.gif",
    "MiladiTarihKisa": "12.01.2026",
    "MiladiTarihKisaIso8601": "12.01.2026",
    "MiladiTarihUzun": "12 Ocak 2026 Pazartesi",
    "MiladiTarihUzunIso8601": "2026-01-12T00:00:00.0000000+08:00",
    "GreenwichOrtalamaZamani": 3.0,
    "Aksam": "17:37",
    "Gunes": "07:13",
    "GunesBatis": "17:30",
    "GunesDogus": "07:20",
    "Ikindi": "15:15",
    "Imsak": "05:53",
    "KibleSaati": "00:00",
    "Ogle": "12:30",
    "Yatsi": "18:47"
  },
  {
    "HicriTarihKisa": "24.7.1447",
    "HicriTarihKisaIso8601": null,
    "HicriTarihUzun": "24 Recep 1447",
    "HicriTarihUzunIso8601": null,
    "AyinSekliURL": "https://namazvakti.diyanet.gov.tr/images/sd3.gif",
    "MiladiTarihKisa": "13.01.2026",
    "MiladiTarihKisaIso8601": "13.01.2026",
    "MiladiTarihUzun": "13 Ocak 2026 Salı",
    "MiladiTarihUzunIso8601": "2026-01-13T00:00:00.0000000+08:00",
    "GreenwichOrtalamaZamani": 3.0,
    "Aksam": "17:38",
    "Gunes": "07:13",
    "GunesBatis": "17:31",
    "GunesDogus": "07:20",
    "Ikindi": "15:16",
    "Imsak": "05:53",
    "KibleSaati": "00:00",
    "Ogle": "12:30",
    "Yatsi": "18:48"
  },
  {
    "HicriTarihKisa": "25.7.1447",
    "HicriTarihKisaIso8601": null,
    "HicriTarihUzun": "25 Recep 1447",
    "HicriTarihUzunIso8601": null,
    "AyinSekliURL": "https://namazvakti.diyanet.gov.tr/images/sd4.gif",
    "MiladiTarihKisa": "14.01.2026",
    "MiladiTarihKisaIso8601": "14.01.2026",
    "MiladiTarihUzun": "14 Ocak 2026 Çarşamba",
    "MiladiTarihUzunIso8601": "2026-01-14T00:00:00.0000000+08:00",
    "GreenwichOrtalamaZamani": 3.0,
    "Aksam": "17:38",
    "Gunes": "07:13",
    "GunesBatis": "17:31",
    "GunesDogus": "07:20",
    "Ikindi": "15:16",
    "Imsak": "05:53",
    "KibleSaati": "00:00",
    "Ogle": "12:31",
    "Yatsi": "18:48"
  },
  {
    "HicriTarihKisa": "26.7.1447",
    "HicriTarihKisaIso8601": null,
    "HicriTarihUzun": "26 Recep 1447",
    "HicriTarihUzunIso8601": null,
    "AyinSekliURL": "https://namazvakti.diyanet.gov.tr/images/sd5.gif",
    "MiladiTarihKisa": "15.01.2026",
    "MiladiTarihKisaIso8601": "15.01.2026",
    "MiladiTarihUzun": "15 Ocak 2026 Perşembe",
    "MiladiTarihUzunIso8601": "2026-01-15T00:00:00.0000000+08:00",
    "GreenwichOrtalamaZamani": 3.0,
    "Aksam": "17:39",
    "Gunes": "07:13",
    "GunesBatis": "17:32",
    "GunesDogus": "07:20",
    "Ikindi": "15:17",
    "Imsak": "05:53",
    "KibleSaati": "00:00",
    "Ogle": "12:31",
    "Yatsi": "18:49"
  },
  {
    "HicriTarihKisa": "27.7.1447",
    "HicriTarihKisaIso8601": null,
    "HicriTarihUzun": "27 Recep 1447",
    "HicriTarihUzunIso8601": null,
    "AyinSekliURL": "https://namazvakti.diyanet.gov.tr/images/sd6.gif",
    "MiladiTarihKisa": "16.01.2026",
    "MiladiTarihKisaIso8601": "16.01.2026",
    "MiladiTarihUzun": "16 Ocak 2026 Cuma",
    "MiladiTarihUzunIso8601": "2026-01-16T00:00:00.0000000+08:00",
    "GreenwichOrtalamaZamani": 3.0,
    "Aksam": "17:40",
    "Gunes": "07:12",
    "GunesBatis": "17:33",
    "GunesDogus": "07:19",
    "Ikindi": "15:18",
    "Imsak": "05:53",
    "KibleSaati": "00:00",
    "Ogle": "12:31",
    "Yatsi": "18:50"
  },
  {
    "HicriTarihKisa": "28.7.1447",
    "HicriTarihKisaIso8601": null,
    "HicriTarihUzun": "28 Recep 1447",
    "HicriTarihUzunIso8601": null,
    "AyinSekliURL": "https://namazvakti.diyanet.gov.tr/images/sd7.gif",
    "MiladiTarihKisa": "17.01.2026",
    "MiladiTarihKisaIso8601": "17.01.2026",
    "MiladiTarihUzun": "17 Ocak 2026 Cumartesi",
    "MiladiTarihUzunIso8601": "2026-01-17T00:00:00.0000000+08:00",
    "GreenwichOrtalamaZamani": 3.0,
    "Aksam": "17:41",
    "Gunes": "07:12",
    "GunesBatis": "17:34",
    "GunesDogus": "07:19",
    "Ikindi": "15:19",
    "Imsak": "05:53",
    "KibleSaati": "00:00",
    "Ogle": "12:32",
    "Yatsi": "18:51"
  },
  {
    "HicriTarihKisa": "29.7.1447",
    "HicriTarihKisaIso8601": null,
    "HicriTarihUzun": "29 Recep 1447",
    "HicriTarihUzunIso8601": null,
    "AyinSekliURL": "https://namazvakti.diyanet.gov.tr/images/ictima.gif",
    "MiladiTarihKisa": "18.01.2026",
    "MiladiTarihKisaIso8601": "18.01.2026",
    "MiladiTarihUzun": "18 Ocak 2026 Pazar",
    "MiladiTarihUzunIso8601": "2026-01-18T00:00:00.0000000+08:00",
    "GreenwichOrtalamaZamani": 3.0,
    "Aksam": "17:42",
    "Gunes": "07:12",
    "GunesBatis": "17:35",
    "GunesDogus": "07:19",
    "Ikindi": "15:20",
    "Imsak": "05:52",
    "KibleSaati": "00:00",
    "Ogle": "12:32",
    "Yatsi": "18:52"
  },
  {
    "HicriTarihKisa": "30.7.1447",
    "HicriTarihKisaIso8601": null,
    "HicriTarihUzun": "30 Recep 1447",
    "HicriTarihUzunIso8601": null,
    "AyinSekliURL": "https://namazvakti.diyanet.gov.tr/images/ruyet.gif",
    "MiladiTarihKisa": "19.01.2026",
    "MiladiTarihKisaIso8601": "19.01.2026",
    "MiladiTarihUzun": "19 Ocak 2026 Pazartesi",
    "MiladiTarihUzunIso8601": "2026-01-19T00:00:00.0000000+08:00",
    "GreenwichOrtalamaZamani": 3.0,
    "Aksam": "17:43",
    "Gunes": "07:12",
    "GunesBatis": "17:36",
    "GunesDogus": "07:19",
    "Ikindi": "15:21",
    "Imsak": "05:52",
    "KibleSaati": "00:00",
    "Ogle": "12:32",
    "Yatsi": "18:53"
  },
  {
    "HicriTarihKisa": "1.8.1447",
    "HicriTarihKisaIso8601": null,
    "HicriTarihUzun": "1 Şaban 1447",
    "HicriTarihUzunIso8601": null,
    "AyinSekliURL": "https://namazvakti.diyanet.gov.tr/images/r1.gif",
    "MiladiTarihKisa": "20.01.2026",
    "MiladiTarihKisaIso8601": "20.01.2026",
    "MiladiTarihUzun": "20 Ocak 2026 Salı",
    "MiladiTarihUzunIso8601": "2026-01-20T00:00:00.0000000+08:00",
    "GreenwichOrtalamaZamani": 3.0,
    "Aksam": "17:44",
    "Gunes": "07:11",
    "GunesBatis": "17:37",
    "GunesDogus": "07:18",
    "Ikindi": "15:21",
    "Imsak": "05:52",
    "KibleSaati": "00:00",
    "Ogle": "12:33",
    "Yatsi": "18:53"
  },
  {
    "HicriTarihKisa": "2.8.1447",
    "HicriTarihKisaIso8601": null,
    "HicriTarihUzun": "2 Şaban 1447",
    "HicriTarihUzunIso8601": null,
    "AyinSekliURL": "https://namazvakti.diyanet.gov.tr/images/r2.gif",
    "MiladiTarihKisa": "21.01.2026",
    "MiladiTarihKisaIso8601": "21.01.2026",
    "MiladiTarihUzun": "21 Ocak 2026 Çarşamba",
    "MiladiTarihUzunIso8601": "2026-01-21T00:00:00.0000000+08:00",
    "GreenwichOrtalamaZamani": 3.0,
    "Aksam": "17:45",
    "Gunes": "07:11",
    "GunesBatis": "17:38",
    "GunesDogus": "07:18",
    "Ikindi": "15:22",
    "Imsak": "05:52",
    "KibleSaati": "00:00",
    "Ogle": "12:33",
    "Yatsi": "18:54"
  },
  {
    "HicriTarihKisa": "3.8.1447",
    "HicriTarihKisaIso8601": null,
    "HicriTarihUzun": "3 Şaban 1447",
    "HicriTarihUzunIso8601": null,
    "AyinSekliURL": "https://namazvakti.diyanet.gov.tr/images/r3.gif",
    "MiladiTarihKisa": "22.01.2026",
    "MiladiTarihKisaIso8601": "22.01.2026",
    "MiladiTarihUzun": "22 Ocak 2026 Perşembe",
    "MiladiTarihUzunIso8601": "2026-01-22T00:00:00.0000000+08:00",
    "GreenwichOrtalamaZamani": 3.0,
    "Aksam": "17:46",
    "Gunes": "07:11",
    "GunesBatis": "17:39",
    "GunesDogus": "07:18",
    "Ikindi": "15:23",
    "Imsak": "05:52",
    "KibleSaati": "00:00",
    "Ogle": "12:33",
    "Yatsi": "18:55"
  },
  {
    "HicriTarihKisa": "4.8.1447",
    "HicriTarihKisaIso8601": null,
    "HicriTarihUzun": "4 Şaban 1447",
    "HicriTarihUzunIso8601": null,
    "AyinSekliURL": "https://namazvakti.diyanet.gov.tr/images/r4.gif",
    "MiladiTarihKisa": "23.01.2026",
    "MiladiTarihKisaIso8601": "23.01.2026",
    "MiladiTarihUzun": "23 Ocak 2026 Cuma",
    "MiladiTarihUzunIso8601": "2026-01-23T00:00:00.0000000+08:00",
    "GreenwichOrtalamaZamani": 3.0,
    "Aksam": "17:47",
    "Gunes": "07:10",
    "GunesBatis": "17:40",
    "GunesDogus": "07:17",
    "Ikindi": "15:24",
    "Imsak": "05:51",
    "KibleSaati": "00:00",
    "Ogle": "12:33",
    "Yatsi": "18:56"
  },
  {
    "HicriTarihKisa": "5.8.1447",
    "HicriTarihKisaIso8601": null,
    "HicriTarihUzun": "5 Şaban 1447",
    "HicriTarihUzunIso8601": null,
    "AyinSekliURL": "https://namazvakti.diyanet.gov.tr/images/r5.gif",
    "MiladiTarihKisa": "24.01.2026",
    "MiladiTarihKisaIso8601": "24.01.2026",
    "MiladiTarihUzun": "24 Ocak 2026 Cumartesi",
    "MiladiTarihUzunIso8601": "2026-01-24T00:00:00.0000000+08:00",
    "GreenwichOrtalamaZamani": 3.0,
    "Aksam": "17:48",
    "Gunes": "07:10",
    "GunesBatis": "17:41",
    "GunesDogus": "07:17",
    "Ikindi": "15:25",
    "Imsak": "05:51",
    "KibleSaati": "00:00",
    "Ogle": "12:34",
    "Yatsi": "18:57"
  },
  {
    "HicriTarihKisa": "6.8.1447",
    "HicriTarihKisaIso8601": null,
    "HicriTarihUzun": "6 Şaban 1447",
    "HicriTarihUzunIso8601": null,
    "AyinSekliURL": "https://namazvakti.diyanet.gov.tr/images/r6.gif",
    "MiladiTarihKisa": "25.01.2026",
    "MiladiTarihKisaIso8601": "25.01.2026",
    "MiladiTarihUzun": "25 Ocak 2026 Pazar",
    "MiladiTarihUzunIso8601": "2026-01-25T00:00:00.0000000+08:00",
    "GreenwichOrtalamaZamani": 3.0,
    "Aksam": "17:49",
    "Gunes": "07:09",
    "GunesBatis": "17:42",
    "GunesDogus": "07:16",
    "Ikindi": "15:25",
    "Imsak": "05:51",
    "KibleSaati": "00:00",
    "Ogle": "12:34",
    "Yatsi": "18:57"
  }
]