[
  {
    "HicriTarihKisa": "4.7.1447",
    "HicriTarihKisaIso8601": null,
    "HicriTarihUzun": "4 Recep 1447",
    "HicriTarihUzunIso8601": null,
    "AyinSekliURL": "https://namazvakti.diyanet.gov.tr/images/r4.gif",
    "MiladiTarihKisa": "24.12.2025",
    "MiladiTarihKisaIso8601": "24.12.2025",
    "MiladiTarihUzun": "24 Aralık 2025 Çarşamba",
    "MiladiTarihUzunIso8601": "2025-12-24T00:00:00.0000000+01:00",
    "GreenwichOrtalamaZamani": 3.0,
    "Aksam": "14:36",
    "Gunes": "09:06",
    "GunesBatis": "14:29",
    "GunesDogus": "09:13",
    "Ikindi": "12:35",
    "Imsak": "06:13",
    "KibleSaati": "09:32",
    "Ogle": "11:56",
    "Yatsi": "17:12"
  },
  {
    "HicriTarihKisa": "5.7.1447",
    "HicriTarihKisaIso8601": null,
    "HicriTarihUzun": "5 Recep 1447",
    "HicriTarihUzunIso8601": null,
    "AyinSekliURL": "https://namazvakti.diyanet.gov.tr/images/r5.gif",
    "MiladiTarihKisa": "25.12.2025",
    "MiladiTarihKisaIso8601": "25.12.2025",
    "MiladiTarihUzun": "25 Aralık 2025 Perşembe",
    "MiladiTarihUzunIso8601": "2025-12-25T00:00:00.0000000+01:00",
    "GreenwichOrtalamaZamani": 3.0,
    "Aksam": "14:37",
    "Gunes": "09:06",
    "GunesBatis": "14:30",
    "GunesDogus": "09:13",
    "Ikindi": "12:36",
    "Imsak": "06:13",
    "KibleSaati": "09:32",
    "Ogle": "11:57",
    "Yatsi": "17:12"
  },
  {
    "HicriTarihKisa": "6.7.1447",
    "HicriTarihKisaIso8601": null,
    "HicriTarihUzun": "6 Recep 1447",
    "HicriTarihUzunIso8601": null,
    "AyinSekliURL": "https://namazvakti.diyanet.gov.tr/images/r6.gif",
    "MiladiTarihKisa": "26.12.2025",
    "MiladiTarihKisaIso8601": "26.12.2025",
    "MiladiTarihUzun": "26 Aralık 2025 Cuma",
    "MiladiTarihUzunIso8601": "2025-12-26T00:00:00.0000000+01:00",
    "GreenwichOrtalamaZamani": 3.0,
    "Aksam": "14:38",
    "Gunes": "09:06",
    "GunesBatis": "14:31",
    "GunesDogus": "09:13",
    "Ikindi": "12:36",
    "Imsak": "06:13",
    "KibleSaati": "09:33",
    "Ogle": "11:57",
    "Yatsi": "17:13"
  },
  {
    "HicriTarihKisa": "7.7.1447",
    "HicriTarihKisaIso8601": null,
    "HicriTarihUzun": "7 Recep 1447",
    "HicriTarihUzunIso8601": null,
    "AyinSekliURL": "https://namazvakti.diyanet.gov.tr/images/ilkdordun.gif",
    "MiladiTarihKisa": "27.12.2025",
    "MiladiTarihKisaIso8601": "27.12.2025",
    "MiladiTarihUzun": "27 Aralık 2025 Cumartesi",
    "MiladiTarihUzunIso8601": "2025-12-27T00:00:00.0000000+01:00",
    "GreenwichOrtalamaZamani": 3.0,
    "Aksam": "14:39",
    "Gunes": "09:06",
    "GunesBatis": "14:32",
    "GunesDogus": "09:13",
    "Ikindi": "12:37",
    "Imsak": "06:13",
    "KibleSaati": "09:33",
    "Ogle": "11:57",
    "Yatsi": "17:14"
  },
  {
    "HicriTarihKisa": "8.7.1447",
    "HicriTarihKisaIso8601": null,
    "HicriTarihUzun": "8 Recep 1447",
    "HicriTarihUzunIso8601": null,
    "AyinSekliURL": "https://namazvakti.diyanet.gov.tr/images/i1.gif",
    "MiladiTarihKisa": "28.12.2025",
    "MiladiTarihKisaIso8601": "28.12.2025",
    "MiladiTarihUzun": "28 Aralık 2025 Pazar",
    "MiladiTarihUzunIso8601": "2025-12-28T00:00:00.0000000+01:00",
    "GreenwichOrtalamaZamani": 3.0,
    "Aksam": "14:40",
    "Gunes": "09:06",
    "GunesBatis": "14:33",
    "GunesDogus": "09:13",
    "Ikindi": "12:38",
    "Imsak": "06:14",
    "KibleSaati": "09:34",
    "Ogle": "11:58",
    "Yatsi": "17:15"
  },
  {
    "HicriTarihKisa": "9.7.1447",
    "HicriTarihKisaIso8601": null,
    "HicriTarihUzun": "9 Recep 1447",
    "HicriTarihUzunIso8601": null,
    "AyinSekliURL": "https://namazvakti.diyanet.gov.tr/images/i2.gif",
    "MiladiTarihKisa": "29.12.2025",
    "MiladiTarihKisaIso8601": "29.12.2025",
    "MiladiTarihUzun": "29 Aralık 2025 Pazartesi",
    "MiladiTarihUzunIso8601": "2025-12-29T00:00:00.0000000+01:00",
    "GreenwichOrtalamaZamani": 3.0,
    "Aksam": "14:41",
    "Gunes": "09:06",
    "GunesBatis": "14:34",
    "GunesDogus": "09:13",
    "Ikindi": "12:39",
    "Imsak": "06:14",
    "KibleSaati": "09:34",
    "Ogle": "11:58",
    "Yatsi": "17:16"
  },
  {
    "HicriTarihKisa": "10.7.1447",
    "HicriTarihKisaIso8601": null,
    "HicriTarihUzun": "10 Recep 1447",
    "HicriTarihUzunIso8601": null,
    "AyinSekliURL": "https://namazvakti.diyanet.gov.tr/images/i3.gif",
    "MiladiTarihKisa": "30.12.2025",
    "MiladiTarihKisaIso8601": "30.12.2025",
    "MiladiTarihUzun": "30 Aralık 2025 Salı",
    "MiladiTarihUzunIso8601": "2025-12-30T00:00:00.0000000+01:00",
    "GreenwichOrtalamaZamani": 3.0,
    "Aksam": "14:42",
    "Gunes": "09:06",
    "GunesBatis": "14:35",
    "GunesDogus": "09:13",
    "Ikindi": "12:40",
    "Imsak": "06:14",
    "KibleSaati": "09:35",
    "Ogle": "11:59",
    "Yatsi": "17:17"
  },
  {
    "HicriTarihKisa": "11.7.1447",
    "HicriTarihKisaIso8601": null,
    "HicriTarihUzun": "11 Recep 1447",
    "HicriTarihUzunIso8601": null,
    "AyinSekliURL": "https://namazvakti.diyanet.gov.tr/images/i4.gif",
    "MiladiTarihKisa": "31.12.2025",
    "MiladiTarihKisaIso8601": "31.12.2025",
    "MiladiTarihUzun": "31 Aralık 2025 Çarşamba",
    "MiladiTarihUzunIso8601": "2025-12-31T00:00:00.0000000+01:00",
    "GreenwichOrtalamaZamani": 3.0,
    "Aksam": "14:44",
    "Gunes": "09:05",
    "GunesBatis": "14:37",
    "GunesDogus": "09:12",
    "Ikindi": "12:41",
    "Imsak": "06:14",
    "KibleSaati": "09:35",
    "Ogle": "11:59",
    "Yatsi": "17:18"
  },
  {
    "HicriTarihKisa": "12.7.1447",
    "HicriTarihKisaIso8601": null,
    "HicriTarihUzun": "12 Recep 1447",
    "HicriTarihUzunIso8601": null,
    "AyinSekliURL": "https://namazvakti.diyanet.gov.tr/images/i6.gif",
    "MiladiTarihKisa": "01.01.2026",
    "MiladiTarihKisaIso8601": "01.01.2026",
    "MiladiTarihUzun": "01 Ocak 2026 Perşembe",
    "MiladiTarihUzunIso8601": "2026-01-01T00:00:00.0000000+01:00",
    "GreenwichOrtalamaZamani": 3.0,
    "Aksam": "14:45",
    "Gunes": "09:05",
    "GunesBatis": "14:38",
    "GunesDogus": "09:12",
    "Ikindi": "12:42",
    "Imsak": "06:14",
    "KibleSaati": "09:36",
    "Ogle": "12:00",
    "Yatsi": "17:19"
  },
  {
    "HicriTarihKisa": "13.7.1447",
    "HicriTarihKisaIso8601": null,
    "HicriTarihUzun": "13 Recep 1447",
    "HicriTarihUzunIso8601": null,
    "AyinSekliURL": "https://namazvakti.diyanet.gov.tr/images/i7.gif",
    "MiladiTarihKisa": "02.01.2026",
    "MiladiTarihKisaIso8601": "02.01.2026",
    "MiladiTarihUzun": "02 Ocak 2026 Cuma",
    "MiladiTarihUzunIso8601": "2026-01-02T00:00:00.0000000+01:00",
    "GreenwichOrtalamaZamani": 3.0,
    "Aksam": "14:47",
    "Gunes": "09:04",
    "GunesBatis": "14:40",
    "GunesDogus": "09:11",
    "Ikindi": "12:43",
    "Imsak": "06:13",
    "KibleSaati": "09:37",
    "Ogle": "12:00",
    "Yatsi": "17:20"
  },
  {
    "HicriTarihKisa": "14.7.1447",
    "HicriTarihKisaIso8601": null,
    "HicriTarihUzun": "14 Recep 1447",
    "HicriTarihUzunIso8601": null,
    "AyinSekliURL": "https://namazvakti.diyanet.gov.tr/images/dolunay.gif",
    "MiladiTarihKisa": "03.01.2026",
    "MiladiTarihKisaIso8601": "03.01.2026",
    "MiladiTarihUzun": "03 Ocak 2026 Cumartesi",
    "MiladiTarihUzunIso8601": "2026-01-03T00:00:00.0000000+01:00",
    "GreenwichOrtalamaZamani": 3.0,
    "Aksam": "14:48",
    "Gunes": "09:03",
    "GunesBatis": "14:41",
    "GunesDogus": "09:10",
    "Ikindi": "12:44",
    "Imsak": "06:13",
    "KibleSaati": "09:37",
    "Ogle": "12:01",
    "Yatsi": "17:21"
  },
  {
    "HicriTarihKisa": "15.7.1447",
    "HicriTarihKisaIso8601": null,
    "HicriTarihUzun": "15 Recep 1447",
    "HicriTarihUzunIso8601": null,
    "AyinSekliURL": "https://namazvakti.diyanet.gov.tr/images/d1.gif",
    "MiladiTarihKisa": "04.01.2026",
    "MiladiTarihKisaIso8601": "04.01.2026",
    "MiladiTarihUzun": "04 Ocak 2026 Pazar",
    "MiladiTarihUzunIso8601": "2026-01-04T00:00:00.0000000+01:00",
    "GreenwichOrtalamaZamani": 3.0,
    "Aksam": "14:50",
    "Gunes": "09:02",
    "GunesBatis": "14:43",
    "GunesDogus": "09:09",
    "Ikindi": "12:45",
    "Imsak": "06:13",
    "KibleSaati": "09:38",
    "Ogle": "12:01",
    "Yatsi": "17:22"
  },
  {
    "HicriTarihKisa": "16.7.1447",
    "HicriTarihKisaIso8601": null,
    "HicriTarihUzun": "16 Recep 1447",
    "HicriTarihUzunIso8601": null,
    "AyinSekliURL": "https://namazvakti.diyanet.gov.tr/images/d2.gif",
    "MiladiTarihKisa": "05.01.2026",
    "MiladiTarihKisaIso8601": "05.01.2026",
    "MiladiTarihUzun": "05 Ocak 2026 Pazartesi",
    "MiladiTarihUzunIso8601": "2026-01-05T00:00:00.0000000+01:00",
    "GreenwichOrtalamaZamani": 3.0,
    "Aksam": "14:52",
    "Gunes": "09:01",
    "GunesBatis": "14:45",
    "GunesDogus": "09:08",
    "Ikindi": "12:47",
    "Imsak": "06:12",
    "KibleSaati": "09:38",
    "Ogle": "12:02",
    "Yatsi": "17:23"
  },
  {
    "HicriTarihKisa": "17.7.1447",
    "HicriTarihKisaIso8601": null,
    "HicriTarihUzun": "17 Recep 1447",
    "HicriTarihUzunIso8601": null,
    "AyinSekliURL": "https://namazvakti.diyanet.gov.tr/images/d3.gif",
    "MiladiTarihKisa": "06.01.2026",
    "MiladiTarihKisaIso8601": "06.01.2026",
    "MiladiTarihUzun": "06 Ocak 2026 Salı",
    "MiladiTarihUzunIso8601": "2026-01-06T00:00:00.0000000+01:00",
    "GreenwichOrtalamaZamani": 3.0,
    "Aksam": "14:54",
    "Gunes": "09:00",
    "GunesBatis": "14:47",
    "GunesDogus": "09:07",
    "Ikindi": "12:48",
    "Imsak": "06:12",
    "KibleSaati": "09:39",
    "Ogle": "12:02",
    "Yatsi": "17:25"
  },
  {
    "HicriTarihKisa": "18.7.1447",
    "HicriTarihKisaIso8601": null,
    "HicriTarihUzun": "18 Recep 1447",
    "HicriTarihUzunIso8601": null,
    "AyinSekliURL": "https://namazvakti.diyanet.gov.tr/images/d4.gif",
    "MiladiTarihKisa": "07.01.2026",
    "MiladiTarihKisaIso8601": "07.01.2026",
    "MiladiTarihUzun": "07 Ocak 2026 Çarşamba",
    "MiladiTarihUzunIso8601": "2026-01-07T00:00:00.0000000+01:00",
    "GreenwichOrtalamaZamani": 3.0,
    "Aksam": "14:56",
    "Gunes": "08:59",
    "GunesBatis": "14:49",
    "GunesDogus": "09:06",
    "Ikindi": "12:49",
    "Imsak": "06:12",
    "KibleSaati": "09:39",
    "Ogle": "12:03",
    "Yatsi": "17:26"
  },
  {
    "HicriTarihKisa": "19.7.1447",
    "HicriTarihKisaIso8601": null,
    "HicriTarihUzun": "19 Recep 1447",
    "HicriTarihUzunIso8601": null,
    "AyinSekliURL": "https://namazvakti.diyanet.gov.tr/images/d5.gif",
    "MiladiTarihKisa": "08.01.2026",
    "MiladiTarihKisaIso8601": "08.01.2026",
    "MiladiTarihUzun": "08 Ocak 2026 Perşembe",
    "MiladiTarihUzunIso8601": "2026-01-08T00:00:00.0000000+01:00",
    "GreenwichOrtalamaZamani": 3.0,
    "Aksam": "14:58",
    "Gunes": "08:58",
    "GunesBatis": "14:51",
    "GunesDogus": "09:05",
    "Ikindi": "12:51",
    "Imsak": "06:11",
    "KibleSaati": "09:40",
    "Ogle": "12:03",
    "Yatsi": "17:28"
  },
  {
    "HicriTarihKisa": "20.7.1447",
    "HicriTarihKisaIso8601": null,
    "HicriTarihUzun": "20 Recep 1447",
    "HicriTarihUzunIso8601": null,
    "AyinSekliURL": "https://namazvakti.diyanet.gov.tr/images/d6.gif",
    "MiladiTarihKisa": "09.01.2026",
    "MiladiTarihKisaIso8601": "09.01.2026",
    "MiladiTarihUzun": "09 Ocak 2026 Cuma",
    "MiladiTarihUzunIso8601": "2026-01-09T00:00:00.0000000+01:00",
    "GreenwichOrtalamaZamani": 3.0,
    "Aksam": "15:00",
    "Gunes": "08:57",
    "GunesBatis": "14:53",
    "GunesDogus": "09:04",
    "Ikindi": "12:52",
    "Imsak": "06:10",
    "KibleSaati": "09:41",
    "Ogle": "12:03",
    "Yatsi": "17:29"
  },
  {
    "HicriTarihKisa": "21.7.1447",
    "HicriTarihKisaIso8601": null,
    "HicriTarihUzun": "21 Recep 1447",
    "HicriTarihUzunIso8601": null,
    "AyinSekliURL": "https://namazvakti.diyanet.gov.tr/images/sondordun.gif",
    "MiladiTarihKisa": "10.01.2026",
    "MiladiTarihKisaIso8601": "10.01.2026",
    "MiladiTarihUzun": "10 Ocak 2026 Cumartesi",
    "MiladiTarihUzunIso8601": "2026-01-10T00:00:00.0000000+01:00",
    "GreenwichOrtalamaZamani": 3.0,
    "Aksam": "15:02",
    "Gunes": "08:55",
    "GunesBatis": "14:55",
    "GunesDogus": "09:02",
    "Ikindi": "12:54",
    "Imsak": "06:10",
    "KibleSaati": "09:41",
    "Ogle": "12:04",
    "Yatsi": "17:31"
  },
  {
    "HicriTarihKisa": "22.7.1447",
    "HicriTarihKisaIso8601": null,
    "HicriTarihUzun": "22 Recep 1447",
    "HicriTarihUzunIso8601": null,
    "AyinSekliURL": "https://namazvakti.diyanet.gov.tr/images/sd1.gif",
    "MiladiTarihKisa": "11.01.2026",
    "MiladiTarihKisaIso8601": "11.01.2026",
    "MiladiTarihUzun": "11 Ocak 2026 Pazar",
    "MiladiTarihUzunIso8601": "2026-01-11T00:00:00.0000000+01:00",
    "GreenwichOrtalamaZamani": 3.0,
    "Aksam": "15:05",
    "Gunes": "08:54",
    "GunesBatis": "14:58",
    "GunesDogus": "09:01",
    "Ikindi": "12:55",
    "Imsak": "06:09",
    "KibleSaati": "09:42",
    "Ogle": "12:04",
    "Yatsi": "17:32"
  },
  {
    "HicriTarihKisa": "23.7.1447",
    "HicriTarihKisaIso8601": null,
    "HicriTarihUzun": "23 Recep 1447",
    "HicriTarihUzunIso8601": null,
    "AyinSekliURL": "https://namazvakti.diyanet.gov.tr/images/sd2.gif",
    "MiladiTarihKisa": "12.01.2026",
    "MiladiTarihKisaIso8601": "12.01.2026",
    "MiladiTarihUzun": "12 Ocak 2026 Pazartesi",
    "MiladiTarihUzunIso8601": "2026-01-12T00:00:00.0000000+01:00",
    "GreenwichOrtalamaZamani": 3.0,
    "Aksam": "15:07",
    "Gunes": "08:52",
    "GunesBatis": "15:00",
    "GunesDogus": "08:59",
    "Ikindi": "12:57",
    "Imsak": "06:08",
    "KibleSaati": "09:42",
    "Ogle": "12:05",
    "Yatsi": "17:34"
  },
  {
    "HicriTarihKisa": "24.7.1447",
    "HicriTarihKisaIso8601": null,
    "HicriTarihUzun": "24 Recep 1447",
    "HicriTarihUzunIso8601": null,
    "AyinSekliURL": "https://namazvakti.diyanet.gov.tr/images/sd3.gif",
    "MiladiTarihKisa": "13.01.2026",
    "MiladiTarihKisaIso8601": "13.01.2026",
    "MiladiTarihUzun": "13 Ocak 2026 Salı",
    "MiladiTarihUzunIso8601": "2026-01-13T00:00:00.0000000+01:00",
    "GreenwichOrtalamaZamani": 3.0,
    "Aksam": "15:09",
    "Gunes": "08:51",
    "GunesBatis": "15:02",
    "GunesDogus": "08:58",
    "Ikindi": "12:58",
    "Imsak": "06:07",
    "KibleSaati": "09:43",
    "Ogle": "12:05",
    "Yatsi": "17:35"
  },
  {
    "HicriTarihKisa": "25.7.1447",
    "HicriTarihKisaIso8601": null,
    "HicriTarihUzun": "25 Recep 1447",
    "HicriTarihUzunIso8601": null,
    "AyinSekliURL": "https://namazvakti.diyanet.gov.tr/images/sd4.gif",
    "MiladiTarihKisa": "14.01.2026",
    "MiladiTarihKisaIso8601": "14.01.2026",
    "MiladiTarihUzun": "14 Ocak 2026 Çarşamba",
    "MiladiTarihUzunIso8601": "2026-01-14T00:00:00.0000000+01:00",
    "GreenwichOrtalamaZamani": 3.0,
    "Aksam": "15:12",
    "Gunes": "08:49",
    "GunesBatis": "15:05",
    "GunesDogus": "08:56",
    "Ikindi": "13:00",
    "Imsak": "06:06",
    "KibleSaati": "09:43",
    "Ogle": "12:05",
    "Yatsi": "17:37"
  },
  {
    "HicriTarihKisa": "26.7.1447",
    "HicriTarihKisaIso8601": null,
    "HicriTarihUzun": "26 Recep 1447",
    "HicriTarihUzunIso8601": null,
    "AyinSekliURL": "https://namazvakti.diyanet.gov.tr/images/sd5.gif",
    "MiladiTarihKisa": "15.01.2026",
    "MiladiTarihKisaIso8601": "15.01.2026",
    "MiladiTarihUzun": "15 Ocak 2026 Perşembe",
    "MiladiTarihUzunIso8601": "2026-01-15T00:00:00.0000000+01:00",
    "GreenwichOrtalamaZamani": 3.0,
    "Aksam": "15:14",
    "Gunes": "08:47",
    "GunesBatis": "15:07",
    "GunesDogus": "08:54",
    "Ikindi": "13:02",
    "Imsak": "06:05",
    "KibleSaati": "09:44",
    "Ogle": "12:06",
    "Yatsi": "17:39"
  },
  {
    "HicriTarihKisa": "27.7.1447",
    "HicriTarihKisaIso8601": null,
    "HicriTarihUzun": "27 Recep 1447",
    "HicriTarihUzunIso8601": null,
    "AyinSekliURL": "https://namazvakti.diyanet.gov.tr/images/sd6.gif",
    "MiladiTarihKisa": "16.01.2026",
    "MiladiTarihKisaIso8601": "16.01.2026",
    "MiladiTarihUzun": "16 Ocak 2026 Cuma",
    "MiladiTarihUzunIso8601": "2026-01-16T00:00:00.0000000+01:00",
    "GreenwichOrtalamaZamani": 3.0,
    "Aksam": "15:17",
    "Gunes": "08:46",
    "GunesBatis": "15:10",
    "GunesDogus": "08:53",
    "Ikindi": "13:03",
    "Imsak": "06:04",
    "KibleSaati": "09:45",
    "Ogle": "12:06",
    "Yatsi": "17:41"
  },
  {
    "HicriTarihKisa": "28.7.1447",
    "HicriTarihKisaIso8601": null,
    "HicriTarihUzun": "28 Recep 1447",
    "HicriTarihUzunIso8601": null,
    "AyinSekliURL": "https://namazvakti.diyanet.gov.tr/images/sd7.gif",
    "MiladiTarihKisa": "17.01.2026",
    "MiladiTarihKisaIso8601": "17.01.2026",
    "MiladiTarihUzun": "17 Ocak 2026 Cumartesi",
    "MiladiTarihUzunIso8601": "2026-01-17T00:00:00.0000000+01:00",
    "GreenwichOrtalamaZamani": 3.0,
    "Aksam": "15:19",
    "Gunes": "08:44",
    "GunesBatis": "15:12",
    "GunesDogus": "08:51",
    "Ikindi": "13:05",
    "Imsak": "06:03",
    "KibleSaati": "09:45",
    "Ogle": "12:07",
    "Yatsi": "17:42"
  },
  {
    "HicriTarihKisa": "29.7.1447",
    "HicriTarihKisaIso8601": null,
    "HicriTarihUzun": "29 Recep 1447",
    "HicriTarihUzunIso8601": null,
    "AyinSekliURL": "https://namazvakti.diyanet.gov.tr/images/ictima.gif",
    "MiladiTarihKisa": "18.01.2026",
    "MiladiTarihKisaIso8601": "18.01.2026",
    "MiladiTarihUzun": "18 Ocak 2026 Pazar",
    "MiladiTarihUzunIso8601": "2026-01-18T00:00:00.0000000+01:00",
    "GreenwichOrtalamaZamani": 3.0,
    "Aksam": "15:22",
    "Gunes": "08:42",
    "GunesBatis": "15:15",
    "GunesDogus": "08:49",
    "Ikindi": "13:07",
    "Imsak": "06:02",
    "KibleSaati": "09:46",
    "Ogle": "12:07",
    "Yatsi": "17:44"
  },
  {
    "HicriTarihKisa": "30.7.1447",
    "HicriTarihKisaIso8601": null,
    "HicriTarihUzun": "30 Recep 1447",
    "HicriTarihUzunIso8601": null,
    "AyinSekliURL": "https://namazvakti.diyanet.gov.tr/images/ruyet.gif",
    "MiladiTarihKisa": "19.01.2026",
    "MiladiTarihKisaIso8601": "19.01.2026",
    "MiladiTarihUzun": "19 Ocak 2026 Pazartesi",
    "MiladiTarihUzunIso8601": "2026-01-19T00:00:00.0000000+01:00",
    "GreenwichOrtalamaZamani": 3.0,
    "Aksam": "15:25",
    "Gunes": "08:40",
    "GunesBatis": "15:18",
    "GunesDogus": "08:47",
    "Ikindi": "13:09",
    "Imsak": "06:01",
    "KibleSaati": "09:46",
    "Ogle": "12:07",
    "Yatsi": "17:46"
  },
  {
    "HicriTarihKisa": "1.8.1447",
    "HicriTarihKisaIso8601": null,
    "HicriTarihUzun": "1 Şaban 1447",
    "HicriTarihUzunIso8601": null,
    "AyinSekliURL": "https://namazvakti.diyanet.gov.tr/images/r1.gif",
    "MiladiTarihKisa": "20.01.2026",
    "MiladiTarihKisaIso8601": "20.01.2026",
    "MiladiTarihUzun": "20 Ocak 2026 Salı",
    "MiladiTarihUzunIso8601": "2026-01-20T00:00:00.0000000+01:00",
    "GreenwichOrtalamaZamani": 3.0,
    "Aksam": "15:27",
    "Gunes": "08:38",
    "GunesBatis": "15:20",
    "GunesDogus": "08:45",
    "Ikindi": "13:11",
    "Imsak": "06:00",
    "KibleSaati": "09:47",
    "Ogle": "12:07",
    "Yatsi": "17:48"
  },
  {
    "HicriTarihKisa": "2.8.1447",
    "HicriTarihKisaIso8601": null,
    "HicriTarihUzun": "2 Şaban 1447",
    "HicriTarihUzunIso8601": null,
    "AyinSekliURL": "https://namazvakti.diyanet.gov.tr/images/r2.gif",
    "MiladiTarihKisa": "21.01.2026",
    "MiladiTarihKisaIso8601": "21.01.2026",
    "MiladiTarihUzun": "21 Ocak 2026 Çarşamba",
    "MiladiTarihUzunIso8601": "2026-01-21T00:00:00.0000000+01:00",
    "GreenwichOrtalamaZamani": 3.0,
    "Aksam": "15:30",
    "Gunes": "08:36",
    "GunesBatis": "15:23",
    "GunesDogus": "08:43",
    "Ikindi": "13:12",
    "Imsak": "05:58",
    "KibleSaati": "09:47",
    "Ogle": "12:08",
    "Yatsi": "17:50"
  },
  {
    "HicriTarihKisa": "3.8.1447",
    "HicriTarihKisaIso8601": null,
    "HicriTarihUzun": "3 Şaban 1447",
    "HicriTarihUzunIso8601": null,
    "AyinSekliURL": "https://namazvakti.diyanet.gov.tr/images/r3.gif",
    "MiladiTarihKisa": "22.01.2026",
    "MiladiTarihKisaIso8601": "22.01.2026",
    "MiladiTarihUzun": "22 Ocak 2026 Perşembe",
    "MiladiTarihUzunIso8601": "2026-01-22T00:00:00.0000000+01:00",
    "GreenwichOrtalamaZamani": 3.0,
    "Aksam": "15:33",
    "Gunes": "08:33",
    "GunesBatis": "15:26",
    "GunesDogus": "08:40",
    "Ikindi": "13:14",
    "Imsak": "05:57",
    "KibleSaati": "09:48",
    "Ogle": "12:08",
    "Yatsi": "17:52"
  },
  {
    "HicriTarihKisa": "4.8.1447",
    "HicriTarihKisaIso8601": null,
    "HicriTarihUzun": "4 Şaban 1447",
    "HicriTarihUzunIso8601": null,
    "AyinSekliURL": "https://namazvakti.diyanet.gov.tr/images/r4.gif",
    "MiladiTarihKisa": "23.01.2026",
    "MiladiTarihKisaIso8601": "23.01.2026",
    "MiladiTarihUzun": "23 Ocak 2026 Cuma",
    "MiladiTarihUzunIso8601": "2026-01-23T00:00:00.0000000+01:00",
    "GreenwichOrtalamaZamani": 3.0,
    "Aksam": "15:35",
    "Gunes": "08:31",
    "GunesBatis": "15:28",
    "GunesDogus": "08:38",
    "Ikindi": "13:16",
    "Imsak": "05:56",
    "KibleSaati": "09:48",
    "Ogle": "12:08",
    "Yatsi": "17:54"
  },
  {
    "HicriTarihKisa": "5.8.1447",
    "HicriTarihKisaIso8601": null,
    "HicriTarihUzun": "5 Şaban 1447",
    "HicriTarihUzunIso8601": null,
    "AyinSekliURL": "https://namazvakti.diyanet.gov.tr/images/r5.gif",
    "MiladiTarihKisa": "24.01.2026",
    "MiladiTarihKisaIso8601": "24.01.2026",
    "MiladiTarihUzun": "24 Ocak 2026 Cumartesi",
    "MiladiTarihUzunIso8601": "2026-01-24T00:00:00.0000000+01:00",
    "GreenwichOrtalamaZamani": 3.0,
    "Aksam": "15:38",
    "Gunes": "08:29",
    "GunesBatis": "15:31",
    "GunesDogus": "08:36",
    "Ikindi": "13:18",
    "Imsak": "05:54",
    "KibleSaati": "09:49",
    "Ogle": "12:09",
    "Yatsi": "17:56"
  }
]